Account,Coin,Execution Price,Size Tokens,Size USD,Side,Timestamp IST,Start Position,Direction,Closed PnL,Transaction Hash,Order ID,Crossed,Fee,Trade ID,Timestamp,time,date,pnl_flag
0xae5eacaf9c6b9111fd53034a602c192a04e082ed,@107,7.9769,986.87,7872.16,BUY,02-12-2024 22:50,0.0,Buy,0.0,0xec09451986a1874e3a980418412fcd0201f500c95bac0f37caef8a734502ec49,52017706630.0,True,0.34540448,895000000000000.0,1730000000000.0,2024-02-12 22:50:00,2024-02-12,Loss
0xae5eacaf9c6b9111fd53034a602c192a04e082ed,@107,7.98,16.0,127.68,BUY,02-12-2024 22:50,986.5245955,Buy,0.0,0xec09451986a1874e3a980418412fcd0201f500c95bac0f37caef8a734502ec49,52017706630.0,True,0.0056,443000000000000.0,1730000000000.0,2024-02-12 22:50:00,2024-02-12,Loss
0xae5eacaf9c6b9111fd53034a602c192a04e082ed,@107,7.9855,144.09,1150.63,BUY,02-12-2024 22:50,1002.518996,Buy,0.0,0xec09451986a1874e3a980418412fcd0201f500c95bac0f37caef8a734502ec49,52017706630.0,True,0.0504314,660000000000000.0,1730000000000.0,2024-02-12 22:50:00,2024-02-12,Loss
0xae5eacaf9c6b9111fd53034a602c192a04e082ed,@107,7.9874,142.98,1142.04,BUY,02-12-2024 22:50,1146.558564,Buy,0.0,0xec09451986a1874e3a980418412fcd0201f500c95bac0f37caef8a734502ec49,52017706630.0,True,0.05004294,1080000000000000.0,1730000000000.0,2024-02-12 22:50:00,2024-02-12,Loss
0xae5eacaf9c6b9111fd53034a602c192a04e082ed,@107,7.9894,8.73,69.75,BUY,02-12-2024 22:50,1289.488521,Buy,0.0,0xec09451986a1874e3a980418412fcd0201f500c95bac0f37caef8a734502ec49,52017706630.0,True,0.00305542,1050000000000000.0,1730000000000.0,2024-02-12 22:50:00,2024-02-12,Loss
0xae5eacaf9c6b9111fd53034a602c192a04e082ed,@107,7.99,1.41,11.27,BUY,02-12-2024 22:50,1298.215466,Buy,0.0,0xec09451986a1874e3a980418412fcd0201f500c95bac0f37caef8a734502ec49,52017706630.0,True,0.00049349,733000000000000.0,1730000000000.0,2024-02-12 22:50:00,2024-02-12,Loss
0xae5eacaf9c6b9111fd53034a602c192a04e082ed,@107,7.9934,144.09,1151.77,BUY,02-12-2024 22:50,1299.624972,Buy,0.0,0xec09451986a1874e3a980418412fcd0201f500c95bac0f37caef8a734502ec49,52017706630.0,True,0.05043148,906000000000000.0,1730000000000.0,2024-02-12 22:50:00,2024-02-12,Loss
0xae5eacaf9c6b9111fd53034a602c192a04e082ed,@107,8.0,34.0,272.0,BUY,02-12-2024 22:50,1443.664541,Buy,0.0,0xec09451986a1874e3a980418412fcd0201f500c95bac0f37caef8a734502ec49,52017706630.0,True,0.0119,396000000000000.0,1730000000000.0,2024-02-12 22:50:00,2024-02-12,Loss
0xae5eacaf9c6b9111fd53034a602c192a04e082ed,@107,8.0,46.0,368.0,BUY,02-12-2024 22:50,1477.652641,Buy,0.0,0xec09451986a1874e3a980418412fcd0201f500c95bac0f37caef8a734502ec49,52017706630.0,True,0.0161,946000000000000.0,1730000000000.0,2024-02-12 22:50:00,2024-02-12,Loss
0xae5eacaf9c6b9111fd53034a602c192a04e082ed,@107,8.0,12.5,100.0,BUY,02-12-2024 22:50,1523.636541,Buy,0.0,0xec09451986a1874e3a980418412fcd0201f500c95bac0f37caef8a734502ec49,52017706630.0,True,0.004375,34700000000000.0,1730000000000.0,2024-02-12 22:50:00,2024-02-12,Loss
0xae5eacaf9c6b9111fd53034a602c192a04e082ed,@107,8.0,1463.33,11706.64,BUY,02-12-2024 22:50,1536.132166,Buy,0.0,0xec09451986a1874e3a980418412fcd0201f500c95bac0f37caef8a734502ec49,52017706630.0,True,0.5121655,94400000000000.0,1730000000000.0,2024-02-12 22:50:00,2024-02-12,Loss
0xae5eacaf9c6b9111fd53034a602c192a04e082ed,@107,7.9457,7.27,57.77,BUY,02-12-2024 22:51,2998.95,Buy,0.0,0x21b8b230ad8a3e9ae1bb041841332f02028300681b0dd484959026f37947df17,52018049026.0,True,0.00254439,938000000000000.0,1730000000000.0,2024-02-12 22:51:00,2024-02-12,Loss
0xae5eacaf9c6b9111fd53034a602c192a04e082ed,@107,7.9487,100.0,794.87,BUY,02-12-2024 22:51,3006.217456,Buy,0.0,0x21b8b230ad8a3e9ae1bb041841332f02028300681b0dd484959026f37947df17,52018049026.0,True,0.03499993,1010000000000000.0,1730000000000.0,2024-02-12 22:51:00,2024-02-12,Loss
0xae5eacaf9c6b9111fd53034a602c192a04e082ed,@107,7.9499,28.62,227.53,BUY,02-12-2024 22:51,3106.182456,Buy,0.0,0x21b8b230ad8a3e9ae1bb041841332f02028300681b0dd484959026f37947df17,52018049026.0,True,0.01001698,123000000000000.0,1730000000000.0,2024-02-12 22:51:00,2024-02-12,Loss
0xae5eacaf9c6b9111fd53034a602c192a04e082ed,@107,7.95,1866.11,14835.57,BUY,02-12-2024 22:51,3134.792439,Buy,0.0,0x21b8b230ad8a3e9ae1bb041841332f02028300681b0dd484959026f37947df17,52018049026.0,True,0.65313849,77800000000000.0,1730000000000.0,2024-02-12 22:51:00,2024-02-12,Loss
0xae5eacaf9c6b9111fd53034a602c192a04e082ed,@107,7.9271,100.0,792.71,BUY,02-12-2024 22:54,5000.249301,Buy,0.0,0xef8b5ed662586d4455030418413ecd01f3009832c599baba9307c5e77a0a81f3,52019096364.0,True,0.03499993,35000000000000.0,1730000000000.0,2024-02-12 22:54:00,2024-02-12,Loss
0xae5eacaf9c6b9111fd53034a602c192a04e082ed,@107,7.9271,98.0,776.86,BUY,02-12-2024 22:54,5100.214301,Buy,0.0,0xef8b5ed662586d4455030418413ecd01f3009832c599baba9307c5e77a0a81f3,52019096364.0,True,0.03429993,1040000000000000.0,1730000000000.0,2024-02-12 22:54:00,2024-02-12,Loss
0xae5eacaf9c6b9111fd53034a602c192a04e082ed,@107,7.9272,21.01,166.55,BUY,02-12-2024 22:54,5198.180001,Buy,0.0,0xef8b5ed662586d4455030418413ecd01f3009832c599baba9307c5e77a0a81f3,52019096364.0,True,0.00735341,922000000000000.0,1730000000000.0,2024-02-12 22:54:00,2024-02-12,Loss
0xae5eacaf9c6b9111fd53034a602c192a04e082ed,@107,7.9275,20.27,160.69,BUY,02-12-2024 22:54,5219.182647,Buy,0.0,0xef8b5ed662586d4455030418413ecd01f3009832c599baba9307c5e77a0a81f3,52019096364.0,True,0.00709441,901000000000000.0,1730000000000.0,2024-02-12 22:54:00,2024-02-12,Loss
0xae5eacaf9c6b9111fd53034a602c192a04e082ed,@107,7.9285,151.92,1204.5,BUY,02-12-2024 22:54,5239.445553,Buy,0.0,0xef8b5ed662586d4455030418413ecd01f3009832c599baba9307c5e77a0a81f3,52019096364.0,True,0.05317197,1080000000000000.0,1730000000000.0,2024-02-12 22:54:00,2024-02-12,Loss
0xae5eacaf9c6b9111fd53034a602c192a04e082ed,@107,7.9292,25.0,198.23,BUY,02-12-2024 22:54,5391.312381,Buy,0.0,0xef8b5ed662586d4455030418413ecd01f3009832c599baba9307c5e77a0a81f3,52019096364.0,True,0.00874993,258000000000000.0,1730000000000.0,2024-02-12 22:54:00,2024-02-12,Loss
0xae5eacaf9c6b9111fd53034a602c192a04e082ed,@107,7.9295,9.0,71.37,BUY,02-12-2024 22:54,5416.303631,Buy,0.0,0xef8b5ed662586d4455030418413ecd01f3009832c599baba9307c5e77a0a81f3,52019096364.0,True,0.00314988,413000000000000.0,1730000000000.0,2024-02-12 22:54:00,2024-02-12,Loss
0xae5eacaf9c6b9111fd53034a602c192a04e082ed,@107,7.9298,144.09,1142.6,BUY,02-12-2024 22:54,5425.300481,Buy,0.0,0xef8b5ed662586d4455030418413ecd01f3009832c599baba9307c5e77a0a81f3,52019096364.0,True,0.05043141,685000000000000.0,1730000000000.0,2024-02-12 22:54:00,2024-02-12,Loss
0xae5eacaf9c6b9111fd53034a602c192a04e082ed,@107,7.9311,16.05,127.29,BUY,02-12-2024 22:54,5569.34005,Buy,0.0,0xef8b5ed662586d4455030418413ecd01f3009832c599baba9307c5e77a0a81f3,52019096364.0,True,0.00561737,651000000000000.0,1730000000000.0,2024-02-12 22:54:00,2024-02-12,Loss
0xae5eacaf9c6b9111fd53034a602c192a04e082ed,@107,7.9315,200.0,1586.3,BUY,02-12-2024 22:54,5585.384432,Buy,0.0,0xef8b5ed662586d4455030418413ecd01f3009832c599baba9307c5e77a0a81f3,52019096364.0,True,0.07,371000000000000.0,1730000000000.0,2024-02-12 22:54:00,2024-02-12,Loss
0xae5eacaf9c6b9111fd53034a602c192a04e082ed,@107,7.9323,294.37,2335.03,BUY,02-12-2024 22:54,5785.314432,Buy,0.0,0xef8b5ed662586d4455030418413ecd01f3009832c599baba9307c5e77a0a81f3,52019096364.0,True,0.10302938,217000000000000.0,1730000000000.0,2024-02-12 22:54:00,2024-02-12,Loss
0xae5eacaf9c6b9111fd53034a602c192a04e082ed,@107,7.9324,259.34,2057.19,BUY,02-12-2024 22:54,6079.581403,Buy,0.0,0xef8b5ed662586d4455030418413ecd01f3009832c599baba9307c5e77a0a81f3,52019096364.0,True,0.09076899,1090000000000.0,1730000000000.0,2024-02-12 22:54:00,2024-02-12,Loss
0xae5eacaf9c6b9111fd53034a602c192a04e082ed,@107,7.9355,311.25,2469.92,BUY,02-12-2024 22:54,6338.830634,Buy,0.0,0xef8b5ed662586d4455030418413ecd01f3009832c599baba9307c5e77a0a81f3,52019096364.0,True,0.10893743,451000000000000.0,1730000000000.0,2024-02-12 22:54:00,2024-02-12,Loss
0xae5eacaf9c6b9111fd53034a602c192a04e082ed,@107,7.9369,94.79,752.34,BUY,02-12-2024 22:54,6649.971696,Buy,0.0,0xef8b5ed662586d4455030418413ecd01f3009832c599baba9307c5e77a0a81f3,52019096364.0,True,0.03317642,174000000000000.0,1730000000000.0,2024-02-12 22:54:00,2024-02-12,Loss
0xae5eacaf9c6b9111fd53034a602c192a04e082ed,@107,7.9377,144.09,1143.74,BUY,02-12-2024 22:54,6744.72852,Buy,0.0,0xef8b5ed662586d4455030418413ecd01f3009832c599baba9307c5e77a0a81f3,52019096364.0,True,0.05043148,159000000000000.0,1730000000000.0,2024-02-12 22:54:00,2024-02-12,Loss
0xae5eacaf9c6b9111fd53034a602c192a04e082ed,@107,7.9457,110.82,880.54,BUY,02-12-2024 22:54,6888.768089,Buy,0.0,0xef8b5ed662586d4455030418413ecd01f3009832c599baba9307c5e77a0a81f3,52019096364.0,True,0.03878689,720000000000000.0,1730000000000.0,2024-02-12 22:54:00,2024-02-12,Loss
0xae5eacaf9c6b9111fd53034a602c192a04e082ed,@107,7.4791,2.0,14.96,BUY,02-12-2024 23:13,6999.549302,Buy,0.0,0x40a5eae7d00acbbfc3c7041841836c02010a00f9d7d3efb504650447a28be717,52025109688.0,True,0.00069995,1040000000000000.0,1730000000000.0,2024-02-12 23:13:00,2024-02-12,Loss
0xae5eacaf9c6b9111fd53034a602c192a04e082ed,@107,7.4832,144.09,1078.25,BUY,02-12-2024 23:13,7001.548602,Buy,0.0,0x40a5eae7d00acbbfc3c7041841836c02010a00f9d7d3efb504650447a28be717,52025109688.0,True,0.05043149,385000000000000.0,1730000000000.0,2024-02-12 23:13:00,2024-02-12,Loss
0xae5eacaf9c6b9111fd53034a602c192a04e082ed,@107,7.4898,340.3,2548.78,BUY,02-12-2024 23:13,7145.58817,Buy,0.0,0x40a5eae7d00acbbfc3c7041841836c02010a00f9d7d3efb504650447a28be717,52025109688.0,True,0.11910491,227000000000000.0,1730000000000.0,2024-02-12 23:13:00,2024-02-12,Loss
0xae5eacaf9c6b9111fd53034a602c192a04e082ed,@107,7.49,1513.61,11336.94,BUY,02-12-2024 23:13,7485.769065,Buy,0.0,0x40a5eae7d00acbbfc3c7041841836c02010a00f9d7d3efb504650447a28be717,52025109688.0,True,0.52976341,245000000000000.0,1730000000000.0,2024-02-12 23:13:00,2024-02-12,Loss
0xae5eacaf9c6b9111fd53034a602c192a04e082ed,@107,7.5204,100.0,752.04,BUY,02-12-2024 23:21,8998.849302,Buy,0.0,0xd273459b8ff175c0c53d041841a2b00201f80053c9adb62a930c0ff2b3d863c0,52027812614.0,True,0.035,302000000000000.0,1730000000000.0,2024-02-12 23:21:00,2024-02-12,Loss
0xae5eacaf9c6b9111fd53034a602c192a04e082ed,@107,7.5205,80.84,607.96,BUY,02-12-2024 23:21,9098.814302,Buy,0.0,0xd273459b8ff175c0c53d041841a2b00201f80053c9adb62a930c0ff2b3d863c0,52027812614.0,True,0.02829399,248000000000000.0,1730000000000.0,2024-02-12 23:21:00,2024-02-12,Loss
0xae5eacaf9c6b9111fd53034a602c192a04e082ed,@107,7.5207,144.09,1083.66,BUY,02-12-2024 23:21,9179.626008,Buy,0.0,0xd273459b8ff175c0c53d041841a2b00201f80053c9adb62a930c0ff2b3d863c0,52027812614.0,True,0.05043147,524000000000000.0,1730000000000.0,2024-02-12 23:21:00,2024-02-12,Loss
0xae5eacaf9c6b9111fd53034a602c192a04e082ed,@107,7.5282,144.09,1084.74,BUY,02-12-2024 23:21,9323.665576,Buy,0.0,0xd273459b8ff175c0c53d041841a2b00201f80053c9adb62a930c0ff2b3d863c0,52027812614.0,True,0.05043144,234000000000000.0,1730000000000.0,2024-02-12 23:21:00,2024-02-12,Loss
0xae5eacaf9c6b9111fd53034a602c192a04e082ed,@107,7.5354,98.0,738.47,BUY,02-12-2024 23:21,9467.705145,Buy,0.0,0xd273459b8ff175c0c53d041841a2b00201f80053c9adb62a930c0ff2b3d863c0,52027812614.0,True,0.03429997,408000000000000.0,1730000000000.0,2024-02-12 23:21:00,2024-02-12,Loss
0xae5eacaf9c6b9111fd53034a602c192a04e082ed,@107,7.5356,43.09,324.71,BUY,02-12-2024 23:21,9565.670845,Buy,0.0,0xd273459b8ff175c0c53d041841a2b00201f80053c9adb62a930c0ff2b3d863c0,52027812614.0,True,0.01508147,969000000000000.0,1730000000000.0,2024-02-12 23:21:00,2024-02-12,Loss
0xae5eacaf9c6b9111fd53034a602c192a04e082ed,@107,7.5357,144.09,1085.82,BUY,02-12-2024 23:21,9608.745764,Buy,0.0,0xd273459b8ff175c0c53d041841a2b00201f80053c9adb62a930c0ff2b3d863c0,52027812614.0,True,0.05043141,88000000000000.0,1730000000000.0,2024-02-12 23:21:00,2024-02-12,Loss
0xae5eacaf9c6b9111fd53034a602c192a04e082ed,@107,7.5359,133.07,1002.8,BUY,02-12-2024 23:21,9752.785332,Buy,0.0,0xd273459b8ff175c0c53d041841a2b00201f80053c9adb62a930c0ff2b3d863c0,52027812614.0,True,0.04657439,1020000000000000.0,1730000000000.0,2024-02-12 23:21:00,2024-02-12,Loss
0xae5eacaf9c6b9111fd53034a602c192a04e082ed,@107,7.5362,114.73,864.63,BUY,02-12-2024 23:21,9885.808758,Buy,0.0,0xd273459b8ff175c0c53d041841a2b00201f80053c9adb62a930c0ff2b3d863c0,52027812614.0,True,0.04015538,920000000000000.0,1730000000000.0,2024-02-12 23:21:00,2024-02-12,Loss
0xae5eacaf9c6b9111fd53034a602c192a04e082ed,@107,9.057,2446.39,22156.95,SELL,03-12-2024 14:39,10000.4986,Sell,3008.231185,0x7b57a76296641058064004184ed84d01d0005daded345e8e64aab2df686f3b1d,52200758791.0,True,7.754933,519000000000000.0,1730000000000.0,2024-03-12 14:39:00,2024-03-12,Profit
0xae5eacaf9c6b9111fd53034a602c192a04e082ed,@107,9.057,25.0,226.43,SELL,03-12-2024 14:39,7554.108602,Sell,30.741534,0x7b57a76296641058064004184ed84d01d0005daded345e8e64aab2df686f3b1d,52200758791.0,True,0.079248,335000000000000.0,1730000000000.0,2024-03-12 14:39:00,2024-03-12,Profit
0xae5eacaf9c6b9111fd53034a602c192a04e082ed,@107,9.048,33.4,302.2,SELL,03-12-2024 14:39,7529.108602,Sell,40.770089,0x7b57a76296641058064004184ed84d01d0005daded345e8e64aab2df686f3b1d,52200758791.0,True,0.105771,514000000000000.0,1730000000000.0,2024-03-12 14:39:00,2024-03-12,Profit
0xae5eacaf9c6b9111fd53034a602c192a04e082ed,@107,9.0464,200.0,1809.28,SELL,03-12-2024 14:39,7495.708602,Sell,243.812267,0x7b57a76296641058064004184ed84d01d0005daded345e8e64aab2df686f3b1d,52200758791.0,True,0.633248,954000000000000.0,1730000000000.0,2024-03-12 14:39:00,2024-03-12,Profit
0xae5eacaf9c6b9111fd53034a602c192a04e082ed,@107,9.0424,209.26,1892.21,SELL,03-12-2024 14:39,7295.708602,Sell,254.263735,0x7b57a76296641058064004184ed84d01d0005daded345e8e64aab2df686f3b1d,52200758791.0,True,0.662274,747000000000000.0,1730000000000.0,2024-03-12 14:39:00,2024-03-12,Profit
0xae5eacaf9c6b9111fd53034a602c192a04e082ed,@107,9.0424,20.0,180.85,SELL,03-12-2024 14:39,7086.448602,Sell,24.301227,0x7b57a76296641058064004184ed84d01d0005daded345e8e64aab2df686f3b1d,52200758791.0,True,0.063296,843000000000000.0,1730000000000.0,2024-03-12 14:39:00,2024-03-12,Profit
0xae5eacaf9c6b9111fd53034a602c192a04e082ed,@107,9.0417,110.8,1001.82,SELL,03-12-2024 14:39,7066.448602,Sell,134.551236,0x7b57a76296641058064004184ed84d01d0005daded345e8e64aab2df686f3b1d,52200758791.0,True,0.350637,980000000000000.0,1730000000000.0,2024-03-12 14:39:00,2024-03-12,Profit
0xae5eacaf9c6b9111fd53034a602c192a04e082ed,@107,9.04,34.0,307.36,SELL,03-12-2024 14:39,6955.648602,Sell,41.230486,0x7b57a76296641058064004184ed84d01d0005daded345e8e64aab2df686f3b1d,52200758791.0,True,0.107576,759000000000000.0,1730000000000.0,2024-03-12 14:39:00,2024-03-12,Profit
0xae5eacaf9c6b9111fd53034a602c192a04e082ed,@107,9.04,500.0,4520.0,SELL,03-12-2024 14:39,6921.648602,Sell,606.330666,0x7b57a76296641058064004184ed84d01d0005daded345e8e64aab2df686f3b1d,52200758791.0,True,1.582,922000000000000.0,1730000000000.0,2024-03-12 14:39:00,2024-03-12,Profit
0xae5eacaf9c6b9111fd53034a602c192a04e082ed,@107,9.04,500.0,4520.0,SELL,03-12-2024 14:39,6421.648602,Sell,606.330666,0x7b57a76296641058064004184ed84d01d0005daded345e8e64aab2df686f3b1d,52200758791.0,True,1.582,300000000000000.0,1730000000000.0,2024-03-12 14:39:00,2024-03-12,Profit
0xae5eacaf9c6b9111fd53034a602c192a04e082ed,@107,9.0397,127.33,1151.03,SELL,03-12-2024 14:39,5921.648602,Sell,154.369969,0x7b57a76296641058064004184ed84d01d0005daded345e8e64aab2df686f3b1d,52200758791.0,True,0.402858,688000000000000.0,1730000000000.0,2024-03-12 14:39:00,2024-03-12,Profit
0xae5eacaf9c6b9111fd53034a602c192a04e082ed,@107,9.039,143.53,1297.37,SELL,03-12-2024 14:39,5794.318602,Sell,173.909751,0x7b57a76296641058064004184ed84d01d0005daded345e8e64aab2df686f3b1d,52200758791.0,True,0.454078,719000000000000.0,1730000000000.0,2024-03-12 14:39:00,2024-03-12,Profit
0xae5eacaf9c6b9111fd53034a602c192a04e082ed,@107,9.0354,11.17,100.93,SELL,03-12-2024 14:39,5650.788602,Sell,13.494046,0x7b57a76296641058064004184ed84d01d0005daded345e8e64aab2df686f3b1d,52200758791.0,True,0.035323,1080000000000000.0,1730000000000.0,2024-03-12 14:39:00,2024-03-12,Profit
0xae5eacaf9c6b9111fd53034a602c192a04e082ed,@107,9.0346,127.33,1150.38,SELL,03-12-2024 14:39,5639.618602,Sell,153.720586,0x7b57a76296641058064004184ed84d01d0005daded345e8e64aab2df686f3b1d,52200758791.0,True,0.402631,1000000000000000.0,1730000000000.0,2024-03-12 14:39:00,2024-03-12,Profit
0xae5eacaf9c6b9111fd53034a602c192a04e082ed,@107,9.0333,73.07,660.06,SELL,03-12-2024 14:39,5512.288602,Sell,88.119595,0x7b57a76296641058064004184ed84d01d0005daded345e8e64aab2df686f3b1d,52200758791.0,True,0.231022,848000000000000.0,1730000000000.0,2024-03-12 14:39:00,2024-03-12,Profit
0xae5eacaf9c6b9111fd53034a602c192a04e082ed,@107,9.0327,28.27,255.35,SELL,03-12-2024 14:39,5439.218602,Sell,34.075565,0x7b57a76296641058064004184ed84d01d0005daded345e8e64aab2df686f3b1d,52200758791.0,True,0.089374,861000000000000.0,1730000000000.0,2024-03-12 14:39:00,2024-03-12,Profit
0xae5eacaf9c6b9111fd53034a602c192a04e082ed,@107,9.0303,212.61,1919.93,SELL,03-12-2024 14:39,5410.948602,Sell,255.761609,0x7b57a76296641058064004184ed84d01d0005daded345e8e64aab2df686f3b1d,52200758791.0,True,0.671976,91400000000000.0,1730000000000.0,2024-03-12 14:39:00,2024-03-12,Profit
0xae5eacaf9c6b9111fd53034a602c192a04e082ed,@107,9.0303,38.8,350.38,SELL,03-12-2024 14:39,5198.338602,Sell,46.6749,0x7b57a76296641058064004184ed84d01d0005daded345e8e64aab2df686f3b1d,52200758791.0,True,0.122631,1000000000000000.0,1730000000000.0,2024-03-12 14:39:00,2024-03-12,Profit
0xae5eacaf9c6b9111fd53034a602c192a04e082ed,@107,9.03,144.09,1301.13,SELL,03-12-2024 14:39,5159.538602,Sell,173.291472,0x7b57a76296641058064004184ed84d01d0005daded345e8e64aab2df686f3b1d,52200758791.0,True,0.455396,544000000000000.0,1730000000000.0,2024-03-12 14:39:00,2024-03-12,Profit
0xae5eacaf9c6b9111fd53034a602c192a04e082ed,@107,9.03,14.95,135.0,SELL,03-12-2024 14:39,5015.448602,Sell,17.979787,0x7b57a76296641058064004184ed84d01d0005daded345e8e64aab2df686f3b1d,52200758791.0,True,0.047249,776000000000000.0,1730000000000.0,2024-03-12 14:39:00,2024-03-12,Profit
0xae5eacaf9c6b9111fd53034a602c192a04e082ed,AAVE,235.03,7.47,1755.67,BUY,03-12-2024 14:42,0.0,Open Long,0.0,0xc35da30116f8a8e1833a04184ee1920201d600c7304c977e72b04c86097a6156,52201279961.0,True,0.614485,775000000000000.0,1730000000000.0,2024-03-12 14:42:00,2024-03-12,Loss
0xae5eacaf9c6b9111fd53034a602c192a04e082ed,AAVE,235.04,9.02,2120.06,BUY,03-12-2024 14:42,7.47,Open Long,0.0,0xc35da30116f8a8e1833a04184ee1920201d600c7304c977e72b04c86097a6156,52201279961.0,True,0.742021,542000000000000.0,1730000000000.0,2024-03-12 14:42:00,2024-03-12,Loss
0xae5eacaf9c6b9111fd53034a602c192a04e082ed,AAVE,235.04,7.72,1814.51,BUY,03-12-2024 14:42,16.49,Open Long,0.0,0xc35da30116f8a8e1833a04184ee1920201d600c7304c977e72b04c86097a6156,52201279961.0,True,0.635078,630000000000000.0,1730000000000.0,2024-03-12 14:42:00,2024-03-12,Loss
0xae5eacaf9c6b9111fd53034a602c192a04e082ed,AAVE,235.09,3.66,860.43,BUY,03-12-2024 14:42,24.21,Open Long,0.0,0xc35da30116f8a8e1833a04184ee1920201d600c7304c977e72b04c86097a6156,52201279961.0,True,0.30115,849000000000000.0,1730000000000.0,2024-03-12 14:42:00,2024-03-12,Loss
0xae5eacaf9c6b9111fd53034a602c192a04e082ed,AAVE,235.09,15.45,3632.14,BUY,03-12-2024 14:42,27.87,Open Long,0.0,0xc35da30116f8a8e1833a04184ee1920201d600c7304c977e72b04c86097a6156,52201279961.0,True,1.271249,796000000000000.0,1730000000000.0,2024-03-12 14:42:00,2024-03-12,Loss
0xae5eacaf9c6b9111fd53034a602c192a04e082ed,AAVE,235.13,156.68,36840.17,BUY,03-12-2024 14:42,43.32,Open Long,0.0,0xc35da30116f8a8e1833a04184ee1920201d600c7304c977e72b04c86097a6156,52201279961.0,True,12.894058,674000000000000.0,1730000000000.0,2024-03-12 14:42:00,2024-03-12,Loss
0xae5eacaf9c6b9111fd53034a602c192a04e082ed,AAVE,235.25,7.89,1856.12,BUY,03-12-2024 14:44,200.0,Open Long,0.0,0x65745825ce5b5f6d49fe04184eeaa2020157009314024d2209f314d559eba712,52201753723.0,True,0.649642,792000000000000.0,1730000000000.0,2024-03-12 14:44:00,2024-03-12,Loss
0xae5eacaf9c6b9111fd53034a602c192a04e082ed,AAVE,235.28,9.07,2133.99,BUY,03-12-2024 14:44,207.89,Open Long,0.0,0x65745825ce5b5f6d49fe04184eeaa2020157009314024d2209f314d559eba712,52201753723.0,True,0.746896,987000000000000.0,1730000000000.0,2024-03-12 14:44:00,2024-03-12,Loss
0xae5eacaf9c6b9111fd53034a602c192a04e082ed,AAVE,235.28,7.66,1802.24,BUY,03-12-2024 14:44,216.96,Open Long,0.0,0x65745825ce5b5f6d49fe04184eeaa2020157009314024d2209f314d559eba712,52201753723.0,True,0.630785,872000000000000.0,1730000000000.0,2024-03-12 14:44:00,2024-03-12,Loss
0xae5eacaf9c6b9111fd53034a602c192a04e082ed,AAVE,235.45,13.17,3100.88,BUY,03-12-2024 14:44,224.62,Open Long,0.0,0x65745825ce5b5f6d49fe04184eeaa2020157009314024d2209f314d559eba712,52201753723.0,True,1.085306,121000000000000.0,1730000000000.0,2024-03-12 14:44:00,2024-03-12,Loss
0xae5eacaf9c6b9111fd53034a602c192a04e082ed,AAVE,235.48,13.17,3101.27,BUY,03-12-2024 14:44,237.79,Open Long,0.0,0x65745825ce5b5f6d49fe04184eeaa2020157009314024d2209f314d559eba712,52201753723.0,True,1.085445,419000000000000.0,1730000000000.0,2024-03-12 14:44:00,2024-03-12,Loss
0xae5eacaf9c6b9111fd53034a602c192a04e082ed,AAVE,235.48,3.19,751.18,BUY,03-12-2024 14:44,250.96,Open Long,0.0,0x65745825ce5b5f6d49fe04184eeaa2020157009314024d2209f314d559eba712,52201753723.0,True,0.262913,563000000000000.0,1730000000000.0,2024-03-12 14:44:00,2024-03-12,Loss
0xae5eacaf9c6b9111fd53034a602c192a04e082ed,AAVE,235.5,9.83,2314.97,BUY,03-12-2024 14:44,254.15,Open Long,0.0,0x65745825ce5b5f6d49fe04184eeaa2020157009314024d2209f314d559eba712,52201753723.0,True,0.810237,938000000000000.0,1730000000000.0,2024-03-12 14:44:00,2024-03-12,Loss
0xae5eacaf9c6b9111fd53034a602c192a04e082ed,AAVE,235.51,13.16,3099.31,BUY,03-12-2024 14:44,263.98,Open Long,0.0,0x65745825ce5b5f6d49fe04184eeaa2020157009314024d2209f314d559eba712,52201753723.0,True,1.084759,349000000000000.0,1730000000000.0,2024-03-12 14:44:00,2024-03-12,Loss
0xae5eacaf9c6b9111fd53034a602c192a04e082ed,AAVE,235.53,2.42,569.98,BUY,03-12-2024 14:44,277.14,Open Long,0.0,0x65745825ce5b5f6d49fe04184eeaa2020157009314024d2209f314d559eba712,52201753723.0,True,0.199493,232000000000000.0,1730000000000.0,2024-03-12 14:44:00,2024-03-12,Loss
0xae5eacaf9c6b9111fd53034a602c192a04e082ed,AAVE,235.54,44.5,10481.53,BUY,03-12-2024 14:44,279.56,Open Long,0.0,0x65745825ce5b5f6d49fe04184eeaa2020157009314024d2209f314d559eba712,52201753723.0,True,3.668535,75700000000000.0,1730000000000.0,2024-03-12 14:44:00,2024-03-12,Loss
0xae5eacaf9c6b9111fd53034a602c192a04e082ed,AAVE,235.55,13.16,3099.84,BUY,03-12-2024 14:44,324.06,Open Long,0.0,0x65745825ce5b5f6d49fe04184eeaa2020157009314024d2209f314d559eba712,52201753723.0,True,1.084943,157000000000000.0,1730000000000.0,2024-03-12 14:44:00,2024-03-12,Loss
0xae5eacaf9c6b9111fd53034a602c192a04e082ed,AAVE,235.57,13.16,3100.1,BUY,03-12-2024 14:44,337.22,Open Long,0.0,0x65745825ce5b5f6d49fe04184eeaa2020157009314024d2209f314d559eba712,52201753723.0,True,1.085035,983000000000000.0,1730000000000.0,2024-03-12 14:44:00,2024-03-12,Loss
0xae5eacaf9c6b9111fd53034a602c192a04e082ed,AAVE,235.59,16.61,3913.15,BUY,03-12-2024 14:44,350.38,Open Long,0.0,0x65745825ce5b5f6d49fe04184eeaa2020157009314024d2209f314d559eba712,52201753723.0,True,1.369602,733000000000000.0,1730000000000.0,2024-03-12 14:44:00,2024-03-12,Loss
0xae5eacaf9c6b9111fd53034a602c192a04e082ed,AAVE,235.59,17.31,4078.06,BUY,03-12-2024 14:44,366.99,Open Long,0.0,0x65745825ce5b5f6d49fe04184eeaa2020157009314024d2209f314d559eba712,52201753723.0,True,1.427322,957000000000000.0,1730000000000.0,2024-03-12 14:44:00,2024-03-12,Loss
0xae5eacaf9c6b9111fd53034a602c192a04e082ed,AAVE,235.65,115.7,27264.71,BUY,03-12-2024 14:44,384.3,Open Long,0.0,0x65745825ce5b5f6d49fe04184eeaa2020157009314024d2209f314d559eba712,52201753723.0,True,9.542646,155000000000000.0,1730000000000.0,2024-03-12 14:44:00,2024-03-12,Loss
0xae5eacaf9c6b9111fd53034a602c192a04e082ed,@107,9.0756,100.0,907.56,SELL,03-12-2024 15:22,5000.498602,Sell,124.826134,0x125ea070e5b6af24d28e04184f784a02018f001d1acb12d38da77f72a68ac0db,52209955900.0,True,0.317646,188000000000000.0,1730000000000.0,2024-03-12 15:22:00,2024-03-12,Profit
0xae5eacaf9c6b9111fd53034a602c192a04e082ed,@107,9.0755,213.54,1937.98,SELL,03-12-2024 15:22,4900.498602,Sell,266.532371,0x125ea070e5b6af24d28e04184f784a02018f001d1acb12d38da77f72a68ac0db,52209955900.0,True,0.678293,866000000000000.0,1730000000000.0,2024-03-12 15:22:00,2024-03-12,Profit
0xae5eacaf9c6b9111fd53034a602c192a04e082ed,@107,9.0755,100.0,907.55,SELL,03-12-2024 15:22,4686.958602,Sell,124.816134,0x125ea070e5b6af24d28e04184f784a02018f001d1acb12d38da77f72a68ac0db,52209955900.0,True,0.317642,479000000000000.0,1730000000000.0,2024-03-12 15:22:00,2024-03-12,Profit
0xae5eacaf9c6b9111fd53034a602c192a04e082ed,@107,9.0755,26.45,240.05,SELL,03-12-2024 15:22,4586.958602,Sell,33.013868,0x125ea070e5b6af24d28e04184f784a02018f001d1acb12d38da77f72a68ac0db,52209955900.0,True,0.084016,529000000000000.0,1730000000000.0,2024-03-12 15:22:00,2024-03-12,Profit
0xae5eacaf9c6b9111fd53034a602c192a04e082ed,@107,9.0752,144.09,1307.65,SELL,03-12-2024 15:22,4560.508602,Sell,179.80434,0x125ea070e5b6af24d28e04184f784a02018f001d1acb12d38da77f72a68ac0db,52209955900.0,True,0.457675,435000000000000.0,1730000000000.0,2024-03-12 15:22:00,2024-03-12,Profit
0xae5eacaf9c6b9111fd53034a602c192a04e082ed,@107,9.0752,30.0,272.26,SELL,03-12-2024 15:22,4416.418602,Sell,37.43584,0x125ea070e5b6af24d28e04184f784a02018f001d1acb12d38da77f72a68ac0db,52209955900.0,True,0.095289,41500000000000.0,1730000000000.0,2024-03-12 15:22:00,2024-03-12,Profit
0xae5eacaf9c6b9111fd53034a602c192a04e082ed,@107,9.0674,10.84,98.29,SELL,03-12-2024 15:22,4386.418602,Sell,13.442265,0x125ea070e5b6af24d28e04184f784a02018f001d1acb12d38da77f72a68ac0db,52209955900.0,True,0.034401,16500000000000.0,1730000000000.0,2024-03-12 15:22:00,2024-03-12,Profit
0xae5eacaf9c6b9111fd53034a602c192a04e082ed,@107,9.0663,3.0,27.2,SELL,03-12-2024 15:22,4375.578602,Sell,3.716884,0x125ea070e5b6af24d28e04184f784a02018f001d1acb12d38da77f72a68ac0db,52209955900.0,True,0.009519,1070000000000000.0,1730000000000.0,2024-03-12 15:22:00,2024-03-12,Profit
0xae5eacaf9c6b9111fd53034a602c192a04e082ed,@107,9.0661,144.09,1306.33,SELL,03-12-2024 15:22,4372.578602,Sell,178.493121,0x125ea070e5b6af24d28e04184f784a02018f001d1acb12d38da77f72a68ac0db,52209955900.0,True,0.457217,136000000000000.0,1730000000000.0,2024-03-12 15:22:00,2024-03-12,Profit
0xae5eacaf9c6b9111fd53034a602c192a04e082ed,@107,9.0658,38.6,349.94,SELL,03-12-2024 15:22,4228.488602,Sell,47.804608,0x125ea070e5b6af24d28e04184f784a02018f001d1acb12d38da77f72a68ac0db,52209955900.0,True,0.122478,730000000000000.0,1730000000000.0,2024-03-12 15:22:00,2024-03-12,Profit
0xae5eacaf9c6b9111fd53034a602c192a04e082ed,@107,9.0642,82.02,743.45,SELL,03-12-2024 15:22,4189.888602,Sell,101.447367,0x125ea070e5b6af24d28e04184f784a02018f001d1acb12d38da77f72a68ac0db,52209955900.0,True,0.260205,391000000000000.0,1730000000000.0,2024-03-12 15:22:00,2024-03-12,Profit
0xae5eacaf9c6b9111fd53034a602c192a04e082ed,@107,9.0642,97.7,885.57,SELL,03-12-2024 15:22,4107.868602,Sell,120.841353,0x125ea070e5b6af24d28e04184f784a02018f001d1acb12d38da77f72a68ac0db,52209955900.0,True,0.30995,568000000000000.0,1730000000000.0,2024-03-12 15:22:00,2024-03-12,Profit
0xae5eacaf9c6b9111fd53034a602c192a04e082ed,@107,9.0613,98.0,888.01,SELL,03-12-2024 15:22,4010.168602,Sell,120.928211,0x125ea070e5b6af24d28e04184f784a02018f001d1acb12d38da77f72a68ac0db,52209955900.0,True,0.310802,18600000000000.0,1730000000000.0,2024-03-12 15:22:00,2024-03-12,Profit
0xae5eacaf9c6b9111fd53034a602c192a04e082ed,@107,9.0611,82.02,743.19,SELL,03-12-2024 15:22,3912.168602,Sell,101.193105,0x125ea070e5b6af24d28e04184f784a02018f001d1acb12d38da77f72a68ac0db,52209955900.0,True,0.260116,857000000000000.0,1730000000000.0,2024-03-12 15:22:00,2024-03-12,Profit
0xae5eacaf9c6b9111fd53034a602c192a04e082ed,@107,9.0579,82.02,742.93,SELL,03-12-2024 15:22,3830.148602,Sell,100.930641,0x125ea070e5b6af24d28e04184f784a02018f001d1acb12d38da77f72a68ac0db,52209955900.0,True,0.260025,134000000000000.0,1730000000000.0,2024-03-12 15:22:00,2024-03-12,Profit
0xae5eacaf9c6b9111fd53034a602c192a04e082ed,@107,9.0571,144.09,1305.04,SELL,03-12-2024 15:22,3748.128602,Sell,177.196311,0x125ea070e5b6af24d28e04184f784a02018f001d1acb12d38da77f72a68ac0db,52209955900.0,True,0.456763,549000000000000.0,1730000000000.0,2024-03-12 15:22:00,2024-03-12,Profit
0xae5eacaf9c6b9111fd53034a602c192a04e082ed,@107,9.0547,82.02,742.67,SELL,03-12-2024 15:22,3604.038602,Sell,100.668177,0x125ea070e5b6af24d28e04184f784a02018f001d1acb12d38da77f72a68ac0db,52209955900.0,True,0.259933,873000000000000.0,1730000000000.0,2024-03-12 15:22:00,2024-03-12,Profit
0xae5eacaf9c6b9111fd53034a602c192a04e082ed,@107,9.0546,30.0,271.64,SELL,03-12-2024 15:22,3522.018602,Sell,36.81784,0x125ea070e5b6af24d28e04184f784a02018f001d1acb12d38da77f72a68ac0db,52209955900.0,True,0.095073,292000000000000.0,1730000000000.0,2024-03-12 15:22:00,2024-03-12,Profit
0xae5eacaf9c6b9111fd53034a602c192a04e082ed,@107,9.0516,82.02,742.41,SELL,03-12-2024 15:22,3492.018602,Sell,100.413915,0x125ea070e5b6af24d28e04184f784a02018f001d1acb12d38da77f72a68ac0db,52209955900.0,True,0.259844,682000000000000.0,1730000000000.0,2024-03-12 15:22:00,2024-03-12,Profit
0xae5eacaf9c6b9111fd53034a602c192a04e082ed,@107,9.0515,100.0,905.15,SELL,03-12-2024 15:22,3409.998602,Sell,122.416134,0x125ea070e5b6af24d28e04184f784a02018f001d1acb12d38da77f72a68ac0db,52209955900.0,True,0.316802,207000000000000.0,1730000000000.0,2024-03-12 15:22:00,2024-03-12,Profit
0xae5eacaf9c6b9111fd53034a602c192a04e082ed,@107,9.0515,50.0,452.58,SELL,03-12-2024 15:22,3309.998602,Sell,61.208067,0x125ea070e5b6af24d28e04184f784a02018f001d1acb12d38da77f72a68ac0db,52209955900.0,True,0.158401,651000000000000.0,1730000000000.0,2024-03-12 15:22:00,2024-03-12,Profit
0xae5eacaf9c6b9111fd53034a602c192a04e082ed,@107,9.05,3.91,35.39,SELL,03-12-2024 15:22,3259.998602,Sell,4.780606,0x125ea070e5b6af24d28e04184f784a02018f001d1acb12d38da77f72a68ac0db,52209955900.0,True,0.012384,640000000000000.0,1730000000000.0,2024-03-12 15:22:00,2024-03-12,Profit
0xae5eacaf9c6b9111fd53034a602c192a04e082ed,@107,9.05,10.0,90.5,SELL,03-12-2024 15:22,3256.088602,Sell,12.226614,0x125ea070e5b6af24d28e04184f784a02018f001d1acb12d38da77f72a68ac0db,52209955900.0,True,0.031675,315000000000000.0,1730000000000.0,2024-03-12 15:22:00,2024-03-12,Profit
0xae5eacaf9c6b9111fd53034a602c192a04e082ed,@107,9.05,574.53,5199.5,SELL,03-12-2024 15:22,3246.088602,Sell,702.455615,0x125ea070e5b6af24d28e04184f784a02018f001d1acb12d38da77f72a68ac0db,52209955900.0,True,1.819823,308000000000000.0,1730000000000.0,2024-03-12 15:22:00,2024-03-12,Profit
0xae5eacaf9c6b9111fd53034a602c192a04e082ed,@107,9.0485,90.1,815.27,SELL,03-12-2024 15:22,2671.558602,Sell,110.026636,0x125ea070e5b6af24d28e04184f784a02018f001d1acb12d38da77f72a68ac0db,52209955900.0,True,0.285344,861000000000000.0,1730000000000.0,2024-03-12 15:22:00,2024-03-12,Profit
0xae5eacaf9c6b9111fd53034a602c192a04e082ed,@107,9.0484,82.02,742.15,SELL,03-12-2024 15:22,2581.458602,Sell,100.151451,0x125ea070e5b6af24d28e04184f784a02018f001d1acb12d38da77f72a68ac0db,52209955900.0,True,0.259752,449000000000000.0,1730000000000.0,2024-03-12 15:22:00,2024-03-12,Profit
0xae5eacaf9c6b9111fd53034a602c192a04e082ed,@107,9.048,144.09,1303.73,SELL,03-12-2024 15:22,2499.438602,Sell,175.885092,0x125ea070e5b6af24d28e04184f784a02018f001d1acb12d38da77f72a68ac0db,52209955900.0,True,0.456304,344000000000000.0,1730000000000.0,2024-03-12 15:22:00,2024-03-12,Profit
0xae5eacaf9c6b9111fd53034a602c192a04e082ed,@107,9.0464,200.0,1809.28,SELL,03-12-2024 15:22,2355.348602,Sell,243.812267,0x125ea070e5b6af24d28e04184f784a02018f001d1acb12d38da77f72a68ac0db,52209955900.0,True,0.633248,137000000000000.0,1730000000000.0,2024-03-12 15:22:00,2024-03-12,Profit
0xae5eacaf9c6b9111fd53034a602c192a04e082ed,@107,9.0453,82.02,741.9,SELL,03-12-2024 15:22,2155.348602,Sell,99.897189,0x125ea070e5b6af24d28e04184f784a02018f001d1acb12d38da77f72a68ac0db,52209955900.0,True,0.259663,279000000000000.0,1730000000000.0,2024-03-12 15:22:00,2024-03-12,Profit
0xae5eacaf9c6b9111fd53034a602c192a04e082ed,@107,9.0448,7.09,64.13,SELL,03-12-2024 15:22,2073.328602,Sell,8.631801,0x125ea070e5b6af24d28e04184f784a02018f001d1acb12d38da77f72a68ac0db,52209955900.0,True,0.022444,200000000000000.0,1730000000000.0,2024-03-12 15:22:00,2024-03-12,Profit
0xae5eacaf9c6b9111fd53034a602c192a04e082ed,@107,9.0431,50.0,452.16,SELL,03-12-2024 15:22,2066.238602,Sell,60.788067,0x125ea070e5b6af24d28e04184f784a02018f001d1acb12d38da77f72a68ac0db,52209955900.0,True,0.158254,682000000000000.0,1730000000000.0,2024-03-12 15:22:00,2024-03-12,Profit
0xae5eacaf9c6b9111fd53034a602c192a04e082ed,@107,9.0421,82.02,741.63,SELL,03-12-2024 15:22,2016.238602,Sell,99.634725,0x125ea070e5b6af24d28e04184f784a02018f001d1acb12d38da77f72a68ac0db,52209955900.0,True,0.259571,883000000000000.0,1730000000000.0,2024-03-12 15:22:00,2024-03-12,Profit
0xae5eacaf9c6b9111fd53034a602c192a04e082ed,@107,9.0421,268.15,2424.64,SELL,03-12-2024 15:22,1934.218602,Sell,325.738252,0x125ea070e5b6af24d28e04184f784a02018f001d1acb12d38da77f72a68ac0db,52209955900.0,True,0.848623,221000000000000.0,1730000000000.0,2024-03-12 15:22:00,2024-03-12,Profit
0xae5eacaf9c6b9111fd53034a602c192a04e082ed,@107,9.041,30.09,272.04,SELL,03-12-2024 15:22,1666.068602,Sell,36.51907,0x125ea070e5b6af24d28e04184f784a02018f001d1acb12d38da77f72a68ac0db,52209955900.0,True,0.095215,326000000000000.0,1730000000000.0,2024-03-12 15:22:00,2024-03-12,Profit
0xae5eacaf9c6b9111fd53034a602c192a04e082ed,@107,9.04,1503.07,13587.75,SELL,03-12-2024 15:22,1635.978602,Sell,1822.714868,0x125ea070e5b6af24d28e04184f784a02018f001d1acb12d38da77f72a68ac0db,52209955900.0,True,4.755713,379000000000000.0,1730000000000.0,2024-03-12 15:22:00,2024-03-12,Profit
0xae5eacaf9c6b9111fd53034a602c192a04e082ed,@107,9.04,56.02,506.42,SELL,03-12-2024 15:22,132.9086024,Sell,67.933288,0x125ea070e5b6af24d28e04184f784a02018f001d1acb12d38da77f72a68ac0db,52209955900.0,True,0.177247,518000000000000.0,1730000000000.0,2024-03-12 15:22:00,2024-03-12,Profit
0xae5eacaf9c6b9111fd53034a602c192a04e082ed,@107,9.04,67.0,605.68,SELL,03-12-2024 15:22,76.88860239,Sell,81.24831,0x125ea070e5b6af24d28e04184f784a02018f001d1acb12d38da77f72a68ac0db,52209955900.0,True,0.211988,698000000000000.0,1730000000000.0,2024-03-12 15:22:00,2024-03-12,Profit
0xae5eacaf9c6b9111fd53034a602c192a04e082ed,@107,9.039,9.88,89.31,SELL,03-12-2024 15:22,9.88860239,Sell,11.971214,0x125ea070e5b6af24d28e04184f784a02018f001d1acb12d38da77f72a68ac0db,52209955900.0,True,0.031256,495000000000000.0,1730000000000.0,2024-03-12 15:22:00,2024-03-12,Profit
0xae5eacaf9c6b9111fd53034a602c192a04e082ed,AAVE,230.51,11.98,2761.51,BUY,03-12-2024 19:38,500.0,Open Long,0.0,0x6154d1710e653b95e6380418532c3802018f00a30ec09c8abf98b4ae508c7d87,52274197780.0,True,0.966528,4030000000000.0,1730000000000.0,2024-03-12 19:38:00,2024-03-12,Loss
0xae5eacaf9c6b9111fd53034a602c192a04e082ed,AAVE,230.52,3.66,843.7,BUY,03-12-2024 19:38,511.98,Open Long,0.0,0x6154d1710e653b95e6380418532c3802018f00a30ec09c8abf98b4ae508c7d87,52274197780.0,True,0.295296,179000000000000.0,1730000000000.0,2024-03-12 19:38:00,2024-03-12,Loss
0xae5eacaf9c6b9111fd53034a602c192a04e082ed,AAVE,230.53,11.98,2761.75,BUY,03-12-2024 19:38,515.64,Open Long,0.0,0x6154d1710e653b95e6380418532c3802018f00a30ec09c8abf98b4ae508c7d87,52274197780.0,True,0.966612,1070000000000000.0,1730000000000.0,2024-03-12 19:38:00,2024-03-12,Loss
0xae5eacaf9c6b9111fd53034a602c192a04e082ed,AAVE,230.55,11.98,2761.99,BUY,03-12-2024 19:38,527.62,Open Long,0.0,0x6154d1710e653b95e6380418532c3802018f00a30ec09c8abf98b4ae508c7d87,52274197780.0,True,0.966696,804000000000000.0,1730000000000.0,2024-03-12 19:38:00,2024-03-12,Loss
0xae5eacaf9c6b9111fd53034a602c192a04e082ed,AAVE,230.57,11.98,2762.23,BUY,03-12-2024 19:38,539.6,Open Long,0.0,0x6154d1710e653b95e6380418532c3802018f00a30ec09c8abf98b4ae508c7d87,52274197780.0,True,0.96678,1030000000000000.0,1730000000000.0,2024-03-12 19:38:00,2024-03-12,Loss
0xae5eacaf9c6b9111fd53034a602c192a04e082ed,AAVE,230.58,16.01,3691.59,BUY,03-12-2024 19:38,551.58,Open Long,0.0,0x6154d1710e653b95e6380418532c3802018f00a30ec09c8abf98b4ae508c7d87,52274197780.0,True,1.292055,143000000000000.0,1730000000000.0,2024-03-12 19:38:00,2024-03-12,Loss
0xae5eacaf9c6b9111fd53034a602c192a04e082ed,AAVE,230.58,15.53,3580.91,BUY,03-12-2024 19:38,567.59,Open Long,0.0,0x6154d1710e653b95e6380418532c3802018f00a30ec09c8abf98b4ae508c7d87,52274197780.0,True,1.253317,429000000000000.0,1730000000000.0,2024-03-12 19:38:00,2024-03-12,Loss
0xae5eacaf9c6b9111fd53034a602c192a04e082ed,AAVE,230.61,15.27,3521.41,BUY,03-12-2024 19:38,583.12,Open Long,0.0,0x6154d1710e653b95e6380418532c3802018f00a30ec09c8abf98b4ae508c7d87,52274197780.0,True,1.232495,521000000000000.0,1730000000000.0,2024-03-12 19:38:00,2024-03-12,Loss
0xae5eacaf9c6b9111fd53034a602c192a04e082ed,AAVE,230.61,14.21,3276.97,BUY,03-12-2024 19:38,598.39,Open Long,0.0,0x6154d1710e653b95e6380418532c3802018f00a30ec09c8abf98b4ae508c7d87,52274197780.0,True,1.146938,269000000000000.0,1730000000000.0,2024-03-12 19:38:00,2024-03-12,Loss
0xae5eacaf9c6b9111fd53034a602c192a04e082ed,AAVE,230.62,4.52,1042.4,BUY,03-12-2024 19:38,612.6,Open Long,0.0,0x6154d1710e653b95e6380418532c3802018f00a30ec09c8abf98b4ae508c7d87,52274197780.0,True,0.36484,742000000000000.0,1730000000000.0,2024-03-12 19:38:00,2024-03-12,Loss
0xae5eacaf9c6b9111fd53034a602c192a04e082ed,AAVE,230.63,15.4,3551.7,BUY,03-12-2024 19:38,617.12,Open Long,0.0,0x6154d1710e653b95e6380418532c3802018f00a30ec09c8abf98b4ae508c7d87,52274197780.0,True,1.243095,1060000000000000.0,1730000000000.0,2024-03-12 19:38:00,2024-03-12,Loss
0xae5eacaf9c6b9111fd53034a602c192a04e082ed,AAVE,230.7,53.25,12284.77,BUY,03-12-2024 19:38,632.52,Open Long,0.0,0x6154d1710e653b95e6380418532c3802018f00a30ec09c8abf98b4ae508c7d87,52274197780.0,True,4.299671,397000000000000.0,1730000000000.0,2024-03-12 19:38:00,2024-03-12,Loss
0xae5eacaf9c6b9111fd53034a602c192a04e082ed,AAVE,230.72,9.83,2267.98,BUY,03-12-2024 19:38,685.77,Open Long,0.0,0x6154d1710e653b95e6380418532c3802018f00a30ec09c8abf98b4ae508c7d87,52274197780.0,True,0.793792,956000000000000.0,1730000000000.0,2024-03-12 19:38:00,2024-03-12,Loss
0xae5eacaf9c6b9111fd53034a602c192a04e082ed,AAVE,230.78,4.26,983.12,BUY,03-12-2024 19:38,695.6,Open Long,0.0,0x6154d1710e653b95e6380418532c3802018f00a30ec09c8abf98b4ae508c7d87,52274197780.0,True,0.344092,687000000000000.0,1730000000000.0,2024-03-12 19:38:00,2024-03-12,Loss
0xae5eacaf9c6b9111fd53034a602c192a04e082ed,AAVE,230.8,148.07,34174.56,BUY,03-12-2024 19:38,699.86,Open Long,0.0,0x6154d1710e653b95e6380418532c3802018f00a30ec09c8abf98b4ae508c7d87,52274197780.0,True,11.961094,738000000000000.0,1730000000000.0,2024-03-12 19:38:00,2024-03-12,Loss
0xae5eacaf9c6b9111fd53034a602c192a04e082ed,AAVE,230.81,84.75,19561.15,BUY,03-12-2024 19:38,847.93,Open Long,0.0,0x6154d1710e653b95e6380418532c3802018f00a30ec09c8abf98b4ae508c7d87,52274197780.0,True,6.846401,33300000000000.0,1730000000000.0,2024-03-12 19:38:00,2024-03-12,Loss
0xae5eacaf9c6b9111fd53034a602c192a04e082ed,AAVE,230.81,33.93,7831.38,BUY,03-12-2024 19:38,932.68,Open Long,0.0,0x6154d1710e653b95e6380418532c3802018f00a30ec09c8abf98b4ae508c7d87,52274197780.0,True,2.740984,795000000000000.0,1730000000000.0,2024-03-12 19:38:00,2024-03-12,Loss
0xae5eacaf9c6b9111fd53034a602c192a04e082ed,AAVE,230.84,9.83,2269.16,BUY,03-12-2024 19:38,966.61,Open Long,0.0,0x6154d1710e653b95e6380418532c3802018f00a30ec09c8abf98b4ae508c7d87,52274197780.0,True,0.794205,154000000000000.0,1730000000000.0,2024-03-12 19:38:00,2024-03-12,Loss
0xae5eacaf9c6b9111fd53034a602c192a04e082ed,AAVE,230.84,23.56,5438.59,BUY,03-12-2024 19:38,976.44,Open Long,0.0,0x6154d1710e653b95e6380418532c3802018f00a30ec09c8abf98b4ae508c7d87,52274197780.0,True,1.903506,472000000000000.0,1730000000000.0,2024-03-12 19:38:00,2024-03-12,Loss
0xae5eacaf9c6b9111fd53034a602c192a04e082ed,AAVE,242.49,14.78,3584.0,SELL,03-12-2024 20:56,1000.0,Close Long,139.418262,0x94e25a0cc04d89b3ad530418544d29020118004cffc994375a96e85d52ffabb0,52305625381.0,True,1.2544,238000000000000.0,1730000000000.0,2024-03-12 20:56:00,2024-03-12,Profit
0xae5eacaf9c6b9111fd53034a602c192a04e082ed,AAVE,242.47,8.65,2097.37,SELL,03-12-2024 20:56,985.22,Close Long,81.421585,0x94e25a0cc04d89b3ad530418544d29020118004cffc994375a96e85d52ffabb0,52305625381.0,True,0.734077,416000000000000.0,1730000000000.0,2024-03-12 20:56:00,2024-03-12,Profit
0xae5eacaf9c6b9111fd53034a602c192a04e082ed,AAVE,242.46,13.67,3314.43,SELL,03-12-2024 20:56,976.57,Close Long,128.537643,0x94e25a0cc04d89b3ad530418544d29020118004cffc994375a96e85d52ffabb0,52305625381.0,True,1.160049,1120000000000000.0,1730000000000.0,2024-03-12 20:56:00,2024-03-12,Profit
0xae5eacaf9c6b9111fd53034a602c192a04e082ed,AAVE,242.45,0.06,14.55,SELL,03-12-2024 20:56,962.9,Close Long,0.563574,0x94e25a0cc04d89b3ad530418544d29020118004cffc994375a96e85d52ffabb0,52305625381.0,True,0.005091,59800000000000.0,1730000000000.0,2024-03-12 20:56:00,2024-03-12,Profit
0xae5eacaf9c6b9111fd53034a602c192a04e082ed,AAVE,242.36,3.68,891.88,SELL,03-12-2024 20:56,962.84,Close Long,34.234672,0x94e25a0cc04d89b3ad530418544d29020118004cffc994375a96e85d52ffabb0,52305625381.0,True,0.312159,648000000000000.0,1730000000000.0,2024-03-12 20:56:00,2024-03-12,Profit
0xae5eacaf9c6b9111fd53034a602c192a04e082ed,AAVE,242.34,101.2,24524.81,SELL,03-12-2024 20:56,959.16,Close Long,939.42948,0x94e25a0cc04d89b3ad530418544d29020118004cffc994375a96e85d52ffabb0,52305625381.0,True,8.583682,502000000000000.0,1730000000000.0,2024-03-12 20:56:00,2024-03-12,Profit
0xae5eacaf9c6b9111fd53034a602c192a04e082ed,AAVE,242.33,3.12,756.07,SELL,03-12-2024 20:56,857.96,Close Long,28.931448,0x94e25a0cc04d89b3ad530418544d29020118004cffc994375a96e85d52ffabb0,52305625381.0,True,0.264624,113000000000000.0,1730000000000.0,2024-03-12 20:56:00,2024-03-12,Profit
0xae5eacaf9c6b9111fd53034a602c192a04e082ed,AAVE,242.32,3.74,906.28,SELL,03-12-2024 20:56,854.84,Close Long,34.643246,0x94e25a0cc04d89b3ad530418544d29020118004cffc994375a96e85d52ffabb0,52305625381.0,True,0.317196,495000000000000.0,1730000000000.0,2024-03-12 20:56:00,2024-03-12,Profit
0xae5eacaf9c6b9111fd53034a602c192a04e082ed,AAVE,242.31,0.07,16.96,SELL,03-12-2024 20:56,851.1,Close Long,0.647703,0x94e25a0cc04d89b3ad530418544d29020118004cffc994375a96e85d52ffabb0,52305625381.0,True,0.005936,509000000000000.0,1730000000000.0,2024-03-12 20:56:00,2024-03-12,Profit
0xae5eacaf9c6b9111fd53034a602c192a04e082ed,AAVE,242.31,29.09,7048.8,SELL,03-12-2024 20:56,851.03,Close Long,269.166861,0x94e25a0cc04d89b3ad530418544d29020118004cffc994375a96e85d52ffabb0,52305625381.0,True,2.467079,513000000000000.0,1730000000000.0,2024-03-12 20:56:00,2024-03-12,Profit
0xae5eacaf9c6b9111fd53034a602c192a04e082ed,AAVE,242.3,30.12,7298.08,SELL,03-12-2024 20:56,821.94,Close Long,278.396148,0x94e25a0cc04d89b3ad530418544d29020118004cffc994375a96e85d52ffabb0,52305625381.0,True,2.554326,255000000000000.0,1730000000000.0,2024-03-12 20:56:00,2024-03-12,Profit
0xae5eacaf9c6b9111fd53034a602c192a04e082ed,AAVE,242.3,4.51,1092.77,SELL,03-12-2024 20:56,791.82,Close Long,41.685479,0x94e25a0cc04d89b3ad530418544d29020118004cffc994375a96e85d52ffabb0,52305625381.0,True,0.38247,975000000000000.0,1730000000000.0,2024-03-12 20:56:00,2024-03-12,Profit
0xae5eacaf9c6b9111fd53034a602c192a04e082ed,AAVE,242.29,4.39,1063.65,SELL,03-12-2024 20:56,787.31,Close Long,40.532431,0x94e25a0cc04d89b3ad530418544d29020118004cffc994375a96e85d52ffabb0,52305625381.0,True,0.372278,360000000000000.0,1730000000000.0,2024-03-12 20:56:00,2024-03-12,Profit
0xae5eacaf9c6b9111fd53034a602c192a04e082ed,AAVE,242.27,167.78,40648.06,SELL,03-12-2024 20:56,782.92,Close Long,1545.740362,0x94e25a0cc04d89b3ad530418544d29020118004cffc994375a96e85d52ffabb0,52305625381.0,True,14.226821,817000000000000.0,1730000000000.0,2024-03-12 20:56:00,2024-03-12,Profit
0xae5eacaf9c6b9111fd53034a602c192a04e082ed,AAVE,242.24,3.09,748.52,SELL,03-12-2024 20:56,615.14,Close Long,28.375161,0x94e25a0cc04d89b3ad530418544d29020118004cffc994375a96e85d52ffabb0,52305625381.0,True,0.261982,1040000000000000.0,1730000000000.0,2024-03-12 20:56:00,2024-03-12,Profit
0xae5eacaf9c6b9111fd53034a602c192a04e082ed,AAVE,242.22,112.05,27140.75,SELL,03-12-2024 20:56,612.05,Close Long,1026.702945,0x94e25a0cc04d89b3ad530418544d29020118004cffc994375a96e85d52ffabb0,52305625381.0,True,9.499262,372000000000000.0,1730000000000.0,2024-03-12 20:56:00,2024-03-12,Profit
0xae5eacaf9c6b9111fd53034a602c192a04e082ed,AAVE,241.89,30.9,7474.4,SELL,03-12-2024 23:37,500.0,Close Long,272.93661,0xf3eaac7a249a973f9d300418569d9c0201ff002479a2ab749700a590d206dc7e,52350488766.0,True,2.61604,879000000000000.0,1730000000000.0,2024-03-12 23:37:00,2024-03-12,Profit
0xae5eacaf9c6b9111fd53034a602c192a04e082ed,AAVE,241.42,20.24,4886.34,SELL,03-12-2024 23:38,469.1,Close Long,169.265096,0xdeab65c7b20aa880410e0418569fa201a6006eaf7e1ecdc2c4d93e475f8cb1f8,52350600477.0,True,1.710219,34200000000000.0,1730000000000.0,2024-03-12 23:38:00,2024-03-12,Profit
0xae5eacaf9c6b9111fd53034a602c192a04e082ed,AAVE,241.4,3.39,818.35,SELL,03-12-2024 23:38,448.86,Close Long,28.282431,0xdeab65c7b20aa880410e0418569fa201a6006eaf7e1ecdc2c4d93e475f8cb1f8,52350600477.0,True,0.286421,293000000000000.0,1730000000000.0,2024-03-12 23:38:00,2024-03-12,Profit
0xae5eacaf9c6b9111fd53034a602c192a04e082ed,AAVE,241.39,14.77,3565.33,SELL,03-12-2024 23:38,445.47,Close Long,123.076933,0xdeab65c7b20aa880410e0418569fa201a6006eaf7e1ecdc2c4d93e475f8cb1f8,52350600477.0,True,1.247865,940000000000000.0,1730000000000.0,2024-03-12 23:38:00,2024-03-12,Profit
0xae5eacaf9c6b9111fd53034a602c192a04e082ed,AAVE,241.38,14.81,3574.84,SELL,03-12-2024 23:38,430.7,Close Long,123.262149,0xdeab65c7b20aa880410e0418569fa201a6006eaf7e1ecdc2c4d93e475f8cb1f8,52350600477.0,True,1.251193,140000000000000.0,1730000000000.0,2024-03-12 23:38:00,2024-03-12,Profit
0xae5eacaf9c6b9111fd53034a602c192a04e082ed,AAVE,241.34,33.93,8188.67,SELL,03-12-2024 23:38,415.89,Close Long,281.038797,0xdeab65c7b20aa880410e0418569fa201a6006eaf7e1ecdc2c4d93e475f8cb1f8,52350600477.0,True,2.866033,250000000000000.0,1730000000000.0,2024-03-12 23:38:00,2024-03-12,Profit
0xae5eacaf9c6b9111fd53034a602c192a04e082ed,AAVE,241.32,29.24,7056.2,SELL,03-12-2024 23:38,381.96,Close Long,241.607196,0xdeab65c7b20aa880410e0418569fa201a6006eaf7e1ecdc2c4d93e475f8cb1f8,52350600477.0,True,2.469668,950000000000000.0,1730000000000.0,2024-03-12 23:38:00,2024-03-12,Profit
0xae5eacaf9c6b9111fd53034a602c192a04e082ed,AAVE,241.29,3.12,752.82,SELL,03-12-2024 23:38,352.72,Close Long,25.686648,0xdeab65c7b20aa880410e0418569fa201a6006eaf7e1ecdc2c4d93e475f8cb1f8,52350600477.0,True,0.263488,783000000000000.0,1730000000000.0,2024-03-12 23:38:00,2024-03-12,Profit
0xae5eacaf9c6b9111fd53034a602c192a04e082ed,AAVE,241.28,17.51,4224.81,SELL,03-12-2024 23:38,349.6,Close Long,143.982979,0xdeab65c7b20aa880410e0418569fa201a6006eaf7e1ecdc2c4d93e475f8cb1f8,52350600477.0,True,1.478684,893000000000000.0,1730000000000.0,2024-03-12 23:38:00,2024-03-12,Profit
0xae5eacaf9c6b9111fd53034a602c192a04e082ed,AAVE,241.25,4.35,1049.44,SELL,03-12-2024 23:38,332.09,Close Long,35.639115,0xdeab65c7b20aa880410e0418569fa201a6006eaf7e1ecdc2c4d93e475f8cb1f8,52350600477.0,True,0.367303,670000000000000.0,1730000000000.0,2024-03-12 23:38:00,2024-03-12,Profit
0xae5eacaf9c6b9111fd53034a602c192a04e082ed,AAVE,241.25,17.51,4224.29,SELL,03-12-2024 23:38,327.74,Close Long,143.457679,0xdeab65c7b20aa880410e0418569fa201a6006eaf7e1ecdc2c4d93e475f8cb1f8,52350600477.0,True,1.4785,978000000000000.0,1730000000000.0,2024-03-12 23:38:00,2024-03-12,Profit
0xae5eacaf9c6b9111fd53034a602c192a04e082ed,AAVE,241.23,69.7,16813.73,SELL,03-12-2024 23:38,310.23,Close Long,569.65113,0xdeab65c7b20aa880410e0418569fa201a6006eaf7e1ecdc2c4d93e475f8cb1f8,52350600477.0,True,5.884805,965000000000000.0,1730000000000.0,2024-03-12 23:38:00,2024-03-12,Profit
0xae5eacaf9c6b9111fd53034a602c192a04e082ed,AAVE,241.18,30.39,7329.46,SELL,03-12-2024 23:38,240.53,Close Long,246.854931,0xdeab65c7b20aa880410e0418569fa201a6006eaf7e1ecdc2c4d93e475f8cb1f8,52350600477.0,True,2.565311,396000000000000.0,1730000000000.0,2024-03-12 23:38:00,2024-03-12,Profit
0xae5eacaf9c6b9111fd53034a602c192a04e082ed,AAVE,241.18,32.61,7864.88,SELL,03-12-2024 23:38,210.14,Close Long,264.887769,0xdeab65c7b20aa880410e0418569fa201a6006eaf7e1ecdc2c4d93e475f8cb1f8,52350600477.0,True,2.752707,396000000000000.0,1730000000000.0,2024-03-12 23:38:00,2024-03-12,Profit
0xae5eacaf9c6b9111fd53034a602c192a04e082ed,AAVE,241.17,17.52,4225.3,SELL,03-12-2024 23:38,177.53,Close Long,142.138008,0xdeab65c7b20aa880410e0418569fa201a6006eaf7e1ecdc2c4d93e475f8cb1f8,52350600477.0,True,1.478854,85200000000000.0,1730000000000.0,2024-03-12 23:38:00,2024-03-12,Profit
0xae5eacaf9c6b9111fd53034a602c192a04e082ed,AAVE,241.15,2.89,696.92,SELL,03-12-2024 23:38,160.01,Close Long,23.388481,0xdeab65c7b20aa880410e0418569fa201a6006eaf7e1ecdc2c4d93e475f8cb1f8,52350600477.0,True,0.243923,931000000000000.0,1730000000000.0,2024-03-12 23:38:00,2024-03-12,Profit
0xae5eacaf9c6b9111fd53034a602c192a04e082ed,AAVE,241.14,0.08,19.29,SELL,03-12-2024 23:38,157.12,Close Long,0.646632,0xdeab65c7b20aa880410e0418569fa201a6006eaf7e1ecdc2c4d93e475f8cb1f8,52350600477.0,True,0.006751,125000000000000.0,1730000000000.0,2024-03-12 23:38:00,2024-03-12,Profit
0xae5eacaf9c6b9111fd53034a602c192a04e082ed,AAVE,241.14,0.7,168.8,SELL,03-12-2024 23:38,157.04,Close Long,5.65803,0xdeab65c7b20aa880410e0418569fa201a6006eaf7e1ecdc2c4d93e475f8cb1f8,52350600477.0,True,0.059079,451000000000000.0,1730000000000.0,2024-03-12 23:38:00,2024-03-12,Profit
0xae5eacaf9c6b9111fd53034a602c192a04e082ed,AAVE,241.14,0.08,19.29,SELL,03-12-2024 23:38,156.34,Close Long,0.646632,0xdeab65c7b20aa880410e0418569fa201a6006eaf7e1ecdc2c4d93e475f8cb1f8,52350600477.0,True,0.006751,17400000000000.0,1730000000000.0,2024-03-12 23:38:00,2024-03-12,Profit
0xae5eacaf9c6b9111fd53034a602c192a04e082ed,AAVE,241.14,0.17,40.99,SELL,03-12-2024 23:38,156.26,Close Long,1.374093,0xdeab65c7b20aa880410e0418569fa201a6006eaf7e1ecdc2c4d93e475f8cb1f8,52350600477.0,True,0.014347,187000000000000.0,1730000000000.0,2024-03-12 23:38:00,2024-03-12,Profit
0xae5eacaf9c6b9111fd53034a602c192a04e082ed,AAVE,241.14,0.08,19.29,SELL,03-12-2024 23:38,156.09,Close Long,0.646632,0xdeab65c7b20aa880410e0418569fa201a6006eaf7e1ecdc2c4d93e475f8cb1f8,52350600477.0,True,0.006751,560000000000000.0,1730000000000.0,2024-03-12 23:38:00,2024-03-12,Profit
0xae5eacaf9c6b9111fd53034a602c192a04e082ed,AAVE,241.09,17.53,4226.31,SELL,03-12-2024 23:38,156.01,Close Long,140.816737,0xdeab65c7b20aa880410e0418569fa201a6006eaf7e1ecdc2c4d93e475f8cb1f8,52350600477.0,True,1.479207,661000000000000.0,1730000000000.0,2024-03-12 23:38:00,2024-03-12,Profit
0xae5eacaf9c6b9111fd53034a602c192a04e082ed,AAVE,241.06,17.53,4225.78,SELL,03-12-2024 23:38,138.48,Close Long,140.290837,0xdeab65c7b20aa880410e0418569fa201a6006eaf7e1ecdc2c4d93e475f8cb1f8,52350600477.0,True,1.479023,945000000000000.0,1730000000000.0,2024-03-12 23:38:00,2024-03-12,Profit
0xae5eacaf9c6b9111fd53034a602c192a04e082ed,AAVE,241.05,3.49,841.26,SELL,03-12-2024 23:38,120.95,Close Long,27.895221,0xdeab65c7b20aa880410e0418569fa201a6006eaf7e1ecdc2c4d93e475f8cb1f8,52350600477.0,True,0.294442,230000000000000.0,1730000000000.0,2024-03-12 23:38:00,2024-03-12,Profit
0xae5eacaf9c6b9111fd53034a602c192a04e082ed,AAVE,241.04,9.83,2369.42,SELL,03-12-2024 23:38,117.46,Close Long,78.471907,0xdeab65c7b20aa880410e0418569fa201a6006eaf7e1ecdc2c4d93e475f8cb1f8,52350600477.0,True,0.829298,629000000000000.0,1730000000000.0,2024-03-12 23:38:00,2024-03-12,Profit
0xae5eacaf9c6b9111fd53034a602c192a04e082ed,AAVE,241.04,4.1,988.26,SELL,03-12-2024 23:38,107.63,Close Long,32.72989,0xdeab65c7b20aa880410e0418569fa201a6006eaf7e1ecdc2c4d93e475f8cb1f8,52350600477.0,True,0.345892,922000000000000.0,1730000000000.0,2024-03-12 23:38:00,2024-03-12,Profit
0xae5eacaf9c6b9111fd53034a602c192a04e082ed,AAVE,241.04,32.98,7949.5,SELL,03-12-2024 23:38,103.53,Close Long,263.276042,0xdeab65c7b20aa880410e0418569fa201a6006eaf7e1ecdc2c4d93e475f8cb1f8,52350600477.0,True,2.782324,987000000000000.0,1730000000000.0,2024-03-12 23:38:00,2024-03-12,Profit
0xae5eacaf9c6b9111fd53034a602c192a04e082ed,AAVE,241.02,31.72,7645.15,SELL,03-12-2024 23:38,70.55,Close Long,252.583188,0xdeab65c7b20aa880410e0418569fa201a6006eaf7e1ecdc2c4d93e475f8cb1f8,52350600477.0,True,2.675804,437000000000000.0,1730000000000.0,2024-03-12 23:38:00,2024-03-12,Profit
0xae5eacaf9c6b9111fd53034a602c192a04e082ed,AAVE,240.97,4.86,1171.11,SELL,03-12-2024 23:38,38.83,Close Long,38.456694,0xdeab65c7b20aa880410e0418569fa201a6006eaf7e1ecdc2c4d93e475f8cb1f8,52350600477.0,True,0.409889,822000000000000.0,1730000000000.0,2024-03-12 23:38:00,2024-03-12,Profit
0xae5eacaf9c6b9111fd53034a602c192a04e082ed,AAVE,240.95,33.35,8035.68,SELL,03-12-2024 23:38,33.97,Close Long,263.228215,0xdeab65c7b20aa880410e0418569fa201a6006eaf7e1ecdc2c4d93e475f8cb1f8,52350600477.0,True,2.812488,1080000000000000.0,1730000000000.0,2024-03-12 23:38:00,2024-03-12,Profit
0xae5eacaf9c6b9111fd53034a602c192a04e082ed,AAVE,240.94,0.62,149.38,SELL,03-12-2024 23:38,0.62,Close Long,4.887398,0xdeab65c7b20aa880410e0418569fa201a6006eaf7e1ecdc2c4d93e475f8cb1f8,52350600477.0,True,0.052283,357000000000000.0,1730000000000.0,2024-03-12 23:38:00,2024-03-12,Profit
0xae5eacaf9c6b9111fd53034a602c192a04e082ed,@107,11.076,0.00860239,0.1,SELL,04-12-2024 05:30,0.00860239,Spot Dust Conversion,0.0,0x0000000000000000000000000000000000000000000000000000000000000000,52410700265.0,True,0.0,0.0,1730000000000.0,2024-04-12 05:30:00,2024-04-12,Loss
0xae5eacaf9c6b9111fd53034a602c192a04e082ed,DYDX,0.60975,2834.9,1728.58,BUY,04-03-2025 23:23,0.0,Open Long,0.0,0x6062349d392719a20336041ee797e502012c0064a4a255deec6b8adf73abac1b,77138632929.0,True,0.580802,981000000000000.0,1740000000000.0,2025-04-03 23:23:00,2025-04-03,Loss
0xae5eacaf9c6b9111fd53034a602c192a04e082ed,DYDX,0.60975,190.9,116.4,BUY,04-03-2025 23:23,2834.9,Open Long,0.0,0x6062349d392719a20336041ee797e502012c0064a4a255deec6b8adf73abac1b,77138632929.0,True,0.03911,832000000000000.0,1740000000000.0,2025-04-03 23:23:00,2025-04-03,Loss
0xae5eacaf9c6b9111fd53034a602c192a04e082ed,DYDX,0.60976,2818.6,1718.67,BUY,04-03-2025 23:23,3025.8,Open Long,0.0,0x6062349d392719a20336041ee797e502012c0064a4a255deec6b8adf73abac1b,77138632929.0,True,0.577472,703000000000000.0,1740000000000.0,2025-04-03 23:23:00,2025-04-03,Loss
0xae5eacaf9c6b9111fd53034a602c192a04e082ed,DYDX,0.60981,3689.6,2249.95,BUY,04-03-2025 23:23,5844.4,Open Long,0.0,0x6062349d392719a20336041ee797e502012c0064a4a255deec6b8adf73abac1b,77138632929.0,True,0.755984,873000000000000.0,1740000000000.0,2025-04-03 23:23:00,2025-04-03,Loss
0xae5eacaf9c6b9111fd53034a602c192a04e082ed,DYDX,0.61007,3688.1,2250.0,BUY,04-03-2025 23:23,9534.0,Open Long,0.0,0x6062349d392719a20336041ee797e502012c0064a4a255deec6b8adf73abac1b,77138632929.0,True,0.755999,968000000000000.0,1740000000000.0,2025-04-03 23:23:00,2025-04-03,Loss
0xae5eacaf9c6b9111fd53034a602c192a04e082ed,DYDX,0.61018,1306.3,797.08,BUY,04-03-2025 23:23,13222.1,Open Long,0.0,0x6062349d392719a20336041ee797e502012c0064a4a255deec6b8adf73abac1b,77138632929.0,True,0.267817,1010000000000000.0,1740000000000.0,2025-04-03 23:23:00,2025-04-03,Loss
0xae5eacaf9c6b9111fd53034a602c192a04e082ed,DYDX,0.61033,3131.3,1911.13,BUY,04-03-2025 23:23,14528.4,Open Long,0.0,0x6062349d392719a20336041ee797e502012c0064a4a255deec6b8adf73abac1b,77138632929.0,True,0.642138,500000000000000.0,1740000000000.0,2025-04-03 23:23:00,2025-04-03,Loss
0xae5eacaf9c6b9111fd53034a602c192a04e082ed,DYDX,0.61039,5238.8,3197.71,BUY,04-03-2025 23:23,17659.7,Open Long,0.0,0x6062349d392719a20336041ee797e502012c0064a4a255deec6b8adf73abac1b,77138632929.0,True,1.07443,942000000000000.0,1740000000000.0,2025-04-03 23:23:00,2025-04-03,Loss
0xae5eacaf9c6b9111fd53034a602c192a04e082ed,DYDX,0.61041,5113.1,3121.09,BUY,04-03-2025 23:23,22898.5,Open Long,0.0,0x6062349d392719a20336041ee797e502012c0064a4a255deec6b8adf73abac1b,77138632929.0,True,1.048684,137000000000000.0,1740000000000.0,2025-04-03 23:23:00,2025-04-03,Loss
0xae5eacaf9c6b9111fd53034a602c192a04e082ed,DYDX,0.61041,1644.7,1003.94,BUY,04-03-2025 23:23,28011.6,Open Long,0.0,0x6062349d392719a20336041ee797e502012c0064a4a255deec6b8adf73abac1b,77138632929.0,True,0.337323,684000000000000.0,1740000000000.0,2025-04-03 23:23:00,2025-04-03,Loss
0xae5eacaf9c6b9111fd53034a602c192a04e082ed,DYDX,0.61102,70343.7,42981.41,BUY,04-03-2025 23:23,29656.3,Open Long,0.0,0x6062349d392719a20336041ee797e502012c0064a4a255deec6b8adf73abac1b,77138632929.0,True,14.441752,1090000000000000.0,1740000000000.0,2025-04-03 23:23:00,2025-04-03,Loss
0xae5eacaf9c6b9111fd53034a602c192a04e082ed,DYDX,0.61087,1467.6,896.51,BUY,04-03-2025 23:23,100000.0,Open Long,0.0,0x6b946ed45a4d03f8d19c041ee7983401d2004bac4b39dc8d08da47060d1be853,77138653594.0,True,0.301227,759000000000000.0,1740000000000.0,2025-04-03 23:23:00,2025-04-03,Loss
0xae5eacaf9c6b9111fd53034a602c192a04e082ed,DYDX,0.61089,2755.7,1683.43,BUY,04-03-2025 23:23,101467.6,Open Long,0.0,0x6b946ed45a4d03f8d19c041ee7983401d2004bac4b39dc8d08da47060d1be853,77138653594.0,True,0.565632,364000000000000.0,1740000000000.0,2025-04-03 23:23:00,2025-04-03,Loss
0xae5eacaf9c6b9111fd53034a602c192a04e082ed,DYDX,0.61103,3152.0,1925.97,BUY,04-03-2025 23:23,104223.3,Open Long,0.0,0x6b946ed45a4d03f8d19c041ee7983401d2004bac4b39dc8d08da47060d1be853,77138653594.0,True,0.647124,74800000000000.0,1740000000000.0,2025-04-03 23:23:00,2025-04-03,Loss
0xae5eacaf9c6b9111fd53034a602c192a04e082ed,DYDX,0.61103,2812.6,1718.58,BUY,04-03-2025 23:23,107375.3,Open Long,0.0,0x6b946ed45a4d03f8d19c041ee7983401d2004bac4b39dc8d08da47060d1be853,77138653594.0,True,0.577443,704000000000000.0,1740000000000.0,2025-04-03 23:23:00,2025-04-03,Loss
0xae5eacaf9c6b9111fd53034a602c192a04e082ed,DYDX,0.61103,66639.8,40718.92,BUY,04-03-2025 23:23,110187.9,Open Long,0.0,0x6b946ed45a4d03f8d19c041ee7983401d2004bac4b39dc8d08da47060d1be853,77138653594.0,True,13.681555,897000000000000.0,1740000000000.0,2025-04-03 23:23:00,2025-04-03,Loss
0xae5eacaf9c6b9111fd53034a602c192a04e082ed,DYDX,0.61126,23172.3,14164.3,BUY,04-03-2025 23:23,176827.7,Open Long,0.0,0x6b946ed45a4d03f8d19c041ee7983401d2004bac4b39dc8d08da47060d1be853,77138653594.0,True,4.759204,386000000000000.0,1740000000000.0,2025-04-03 23:23:00,2025-04-03,Loss
0xae5eacaf9c6b9111fd53034a602c192a04e082ed,DYDX,0.6089,3256.6,1982.94,BUY,04-03-2025 23:27,200000.0,Open Long,0.0,0x7c38cc0b7ee4f569db0a041ee7a3f80201b700d75a8583401bfb55cfe462a4fd,77139725540.0,True,0.666268,345000000000000.0,1740000000000.0,2025-04-03 23:27:00,2025-04-03,Loss
0xae5eacaf9c6b9111fd53034a602c192a04e082ed,DYDX,0.6089,3171.0,1930.82,BUY,04-03-2025 23:27,203256.6,Open Long,0.0,0x7c38cc0b7ee4f569db0a041ee7a3f80201b700d75a8583401bfb55cfe462a4fd,77139725540.0,True,0.648755,363000000000000.0,1740000000000.0,2025-04-03 23:27:00,2025-04-03,Loss
0xae5eacaf9c6b9111fd53034a602c192a04e082ed,DYDX,0.60891,420.7,256.17,BUY,04-03-2025 23:27,206427.6,Open Long,0.0,0x7c38cc0b7ee4f569db0a041ee7a3f80201b700d75a8583401bfb55cfe462a4fd,77139725540.0,True,0.086071,750000000000000.0,1740000000000.0,2025-04-03 23:27:00,2025-04-03,Loss
0xae5eacaf9c6b9111fd53034a602c192a04e082ed,DYDX,0.60914,43151.7,26285.43,BUY,04-03-2025 23:27,206848.3,Open Long,0.0,0x7c38cc0b7ee4f569db0a041ee7a3f80201b700d75a8583401bfb55cfe462a4fd,77139725540.0,True,8.831903,588000000000000.0,1740000000000.0,2025-04-03 23:27:00,2025-04-03,Loss
0xae5eacaf9c6b9111fd53034a602c192a04e082ed,DYDX,0.62978,2995.8,1886.69,BUY,05-03-2025 12:42,250000.0,Open Long,0.0,0x8998b4f2faf5cdbde677041ef098c201c00099b6a8de4be6fcf13324ee8ca6f0,77303094404.0,True,0.633929,427000000000000.0,1740000000000.0,2025-05-03 12:42:00,2025-05-03,Loss
0xae5eacaf9c6b9111fd53034a602c192a04e082ed,DYDX,0.62978,2625.3,1653.36,BUY,05-03-2025 12:42,252995.8,Open Long,0.0,0x8998b4f2faf5cdbde677041ef098c201c00099b6a8de4be6fcf13324ee8ca6f0,77303094404.0,True,0.555528,447000000000000.0,1740000000000.0,2025-05-03 12:42:00,2025-05-03,Loss
0xae5eacaf9c6b9111fd53034a602c192a04e082ed,DYDX,0.62979,18.3,11.53,BUY,05-03-2025 12:42,255621.1,Open Long,0.0,0x8998b4f2faf5cdbde677041ef098c201c00099b6a8de4be6fcf13324ee8ca6f0,77303094404.0,True,0.003871,86400000000000.0,1740000000000.0,2025-05-03 12:42:00,2025-05-03,Loss
0xae5eacaf9c6b9111fd53034a602c192a04e082ed,DYDX,0.62979,27.9,17.57,BUY,05-03-2025 12:42,255639.4,Open Long,0.0,0x8998b4f2faf5cdbde677041ef098c201c00099b6a8de4be6fcf13324ee8ca6f0,77303094404.0,True,0.005903,627000000000000.0,1740000000000.0,2025-05-03 12:42:00,2025-05-03,Loss
0xae5eacaf9c6b9111fd53034a602c192a04e082ed,DYDX,0.62979,27.9,17.57,BUY,05-03-2025 12:42,255667.3,Open Long,0.0,0x8998b4f2faf5cdbde677041ef098c201c00099b6a8de4be6fcf13324ee8ca6f0,77303094404.0,True,0.005903,828000000000000.0,1740000000000.0,2025-05-03 12:42:00,2025-05-03,Loss
0xae5eacaf9c6b9111fd53034a602c192a04e082ed,DYDX,0.62982,212.3,133.71,BUY,05-03-2025 12:42,255695.2,Open Long,0.0,0x8998b4f2faf5cdbde677041ef098c201c00099b6a8de4be6fcf13324ee8ca6f0,77303094404.0,True,0.044926,730000000000000.0,1740000000000.0,2025-05-03 12:42:00,2025-05-03,Loss
0xae5eacaf9c6b9111fd53034a602c192a04e082ed,DYDX,0.62996,3571.6,2249.97,BUY,05-03-2025 12:42,255907.5,Open Long,0.0,0x8998b4f2faf5cdbde677041ef098c201c00099b6a8de4be6fcf13324ee8ca6f0,77303094404.0,True,0.755987,473000000000000.0,1740000000000.0,2025-05-03 12:42:00,2025-05-03,Loss
0xae5eacaf9c6b9111fd53034a602c192a04e082ed,DYDX,0.63014,1587.3,1000.22,BUY,05-03-2025 12:42,259479.1,Open Long,0.0,0x8998b4f2faf5cdbde677041ef098c201c00099b6a8de4be6fcf13324ee8ca6f0,77303094404.0,True,0.336073,1020000000000000.0,1740000000000.0,2025-05-03 12:42:00,2025-05-03,Loss
0xae5eacaf9c6b9111fd53034a602c192a04e082ed,DYDX,0.63018,38933.6,24535.18,BUY,05-03-2025 12:42,261066.4,Open Long,0.0,0x8998b4f2faf5cdbde677041ef098c201c00099b6a8de4be6fcf13324ee8ca6f0,77303094404.0,True,8.243818,801000000000000.0,1740000000000.0,2025-05-03 12:42:00,2025-05-03,Loss
0xae5eacaf9c6b9111fd53034a602c192a04e082ed,DYDX,0.55272,4070.7,2249.96,BUY,11-03-2025 13:34,300000.0,Open Long,0.0,0x68d7fed49560cb1e2764041f54302101bc009a22fff7f92e23269fe950249d25,78982420617.0,True,0.755985,951000000000000.0,1740000000000.0,2025-11-03 13:34:00,2025-11-03,Loss
0xae5eacaf9c6b9111fd53034a602c192a04e082ed,DYDX,0.55295,4069.0,2249.95,BUY,11-03-2025 13:34,304070.7,Open Long,0.0,0x68d7fed49560cb1e2764041f54302101bc009a22fff7f92e23269fe950249d25,78982420617.0,True,0.755983,448000000000000.0,1740000000000.0,2025-11-03 13:34:00,2025-11-03,Loss
0xae5eacaf9c6b9111fd53034a602c192a04e082ed,DYDX,0.55295,3670.9,2029.82,BUY,11-03-2025 13:34,308139.7,Open Long,0.0,0x68d7fed49560cb1e2764041f54302101bc009a22fff7f92e23269fe950249d25,78982420617.0,True,0.68202,3920000000000.0,1740000000000.0,2025-11-03 13:34:00,2025-11-03,Loss
0xae5eacaf9c6b9111fd53034a602c192a04e082ed,DYDX,0.55298,38189.4,21117.97,BUY,11-03-2025 13:34,311810.6,Open Long,0.0,0x68d7fed49560cb1e2764041f54302101bc009a22fff7f92e23269fe950249d25,78982420617.0,True,7.095639,940000000000000.0,1740000000000.0,2025-11-03 13:34:00,2025-11-03,Loss
0xae5eacaf9c6b9111fd53034a602c192a04e082ed,DYDX,0.52874,255.9,135.3,BUY,08-04-2025 20:50,500000.0,Open Long,0.0,0x83c9e316f590797a964f042126f938020205000a3f21a8e1e2d56f96a9f040ff,84997192549.0,True,0.045461,187000000000000.0,1740000000000.0,2025-08-04 20:50:00,2025-08-04,Loss
0xae5eacaf9c6b9111fd53034a602c192a04e082ed,DYDX,0.52887,149.2,78.91,BUY,08-04-2025 20:50,500255.9,Open Long,0.0,0x83c9e316f590797a964f042126f938020205000a3f21a8e1e2d56f96a9f040ff,84997192549.0,True,0.026512,450000000000000.0,1740000000000.0,2025-08-04 20:50:00,2025-08-04,Loss
0xae5eacaf9c6b9111fd53034a602c192a04e082ed,DYDX,0.52895,4253.7,2249.99,BUY,08-04-2025 20:50,500405.1,Open Long,0.0,0x83c9e316f590797a964f042126f938020205000a3f21a8e1e2d56f96a9f040ff,84997192549.0,True,0.755998,805000000000000.0,1740000000000.0,2025-08-04 20:50:00,2025-08-04,Loss
0xae5eacaf9c6b9111fd53034a602c192a04e082ed,DYDX,0.52896,1890.3,999.89,BUY,08-04-2025 20:50,504658.8,Open Long,0.0,0x83c9e316f590797a964f042126f938020205000a3f21a8e1e2d56f96a9f040ff,84997192549.0,True,0.335963,646000000000000.0,1740000000000.0,2025-08-04 20:50:00,2025-08-04,Loss
0xae5eacaf9c6b9111fd53034a602c192a04e082ed,DYDX,0.52902,14051.0,7433.26,BUY,08-04-2025 20:50,506549.1,Open Long,0.0,0x83c9e316f590797a964f042126f938020205000a3f21a8e1e2d56f96a9f040ff,84997192549.0,True,2.497575,395000000000000.0,1740000000000.0,2025-08-04 20:50:00,2025-08-04,Loss
0xae5eacaf9c6b9111fd53034a602c192a04e082ed,DYDX,0.52905,14048.2,7432.2,BUY,08-04-2025 20:50,520600.1,Open Long,0.0,0x83c9e316f590797a964f042126f938020205000a3f21a8e1e2d56f96a9f040ff,84997192549.0,True,2.497219,284000000000000.0,1740000000000.0,2025-08-04 20:50:00,2025-08-04,Loss
0xae5eacaf9c6b9111fd53034a602c192a04e082ed,DYDX,0.52907,1259.9,666.58,BUY,08-04-2025 20:50,534648.3,Open Long,0.0,0x83c9e316f590797a964f042126f938020205000a3f21a8e1e2d56f96a9f040ff,84997192549.0,True,0.223968,201000000000000.0,1740000000000.0,2025-08-04 20:50:00,2025-08-04,Loss
0xae5eacaf9c6b9111fd53034a602c192a04e082ed,DYDX,0.52908,14324.8,7578.97,BUY,08-04-2025 20:50,535908.2,Open Long,0.0,0x83c9e316f590797a964f042126f938020205000a3f21a8e1e2d56f96a9f040ff,84997192549.0,True,2.546531,142000000000000.0,1740000000000.0,2025-08-04 20:50:00,2025-08-04,Loss
0xae5eacaf9c6b9111fd53034a602c192a04e082ed,DYDX,0.52914,1568.6,830.01,BUY,08-04-2025 20:50,550233.0,Open Long,0.0,0x83c9e316f590797a964f042126f938020205000a3f21a8e1e2d56f96a9f040ff,84997192549.0,True,0.278882,971000000000000.0,1740000000000.0,2025-08-04 20:50:00,2025-08-04,Loss
0xae5eacaf9c6b9111fd53034a602c192a04e082ed,DYDX,0.52916,4252.0,2249.99,BUY,08-04-2025 20:50,551801.6,Open Long,0.0,0x83c9e316f590797a964f042126f938020205000a3f21a8e1e2d56f96a9f040ff,84997192549.0,True,0.755995,239000000000000.0,1740000000000.0,2025-08-04 20:50:00,2025-08-04,Loss
0xae5eacaf9c6b9111fd53034a602c192a04e082ed,DYDX,0.52937,4250.3,2249.98,BUY,08-04-2025 20:50,556053.6,Open Long,0.0,0x83c9e316f590797a964f042126f938020205000a3f21a8e1e2d56f96a9f040ff,84997192549.0,True,0.755993,611000000000000.0,1740000000000.0,2025-08-04 20:50:00,2025-08-04,Loss
0xae5eacaf9c6b9111fd53034a602c192a04e082ed,DYDX,0.52957,1268.5,671.76,BUY,08-04-2025 20:50,560303.9,Open Long,0.0,0x83c9e316f590797a964f042126f938020205000a3f21a8e1e2d56f96a9f040ff,84997192549.0,True,0.22571,1030000000000000.0,1740000000000.0,2025-08-04 20:50:00,2025-08-04,Loss
0xae5eacaf9c6b9111fd53034a602c192a04e082ed,DYDX,0.52958,1201.7,636.4,BUY,08-04-2025 20:50,561572.4,Open Long,0.0,0x83c9e316f590797a964f042126f938020205000a3f21a8e1e2d56f96a9f040ff,84997192549.0,True,0.213828,455000000000000.0,1740000000000.0,2025-08-04 20:50:00,2025-08-04,Loss
0xae5eacaf9c6b9111fd53034a602c192a04e082ed,DYDX,0.52992,2358.8,1249.98,BUY,08-04-2025 20:50,562774.1,Open Long,0.0,0x83c9e316f590797a964f042126f938020205000a3f21a8e1e2d56f96a9f040ff,84997192549.0,True,0.419991,596000000000000.0,1740000000000.0,2025-08-04 20:50:00,2025-08-04,Loss
0xae5eacaf9c6b9111fd53034a602c192a04e082ed,DYDX,0.52993,34867.1,18477.12,BUY,08-04-2025 20:50,565132.9,Open Long,0.0,0x83c9e316f590797a964f042126f938020205000a3f21a8e1e2d56f96a9f040ff,84997192549.0,True,6.208312,53900000000000.0,1740000000000.0,2025-08-04 20:50:00,2025-08-04,Loss
0xae5eacaf9c6b9111fd53034a602c192a04e082ed,AIXBT,0.069298,7202.0,499.08,BUY,08-04-2025 22:27,0.0,Open Long,0.0,0x7c52a54804544bc068620421281a9701f4004f4cdfbf3428013b9c4ac5c2a592,85021032792.0,True,0.167691,27500000000000.0,1740000000000.0,2025-08-04 22:27:00,2025-08-04,Loss
0xae5eacaf9c6b9111fd53034a602c192a04e082ed,AIXBT,0.069302,11279.0,781.66,BUY,08-04-2025 22:27,7202.0,Open Long,0.0,0x7c52a54804544bc068620421281a9701f4004f4cdfbf3428013b9c4ac5c2a592,85021032792.0,True,0.262636,750000000000000.0,1740000000000.0,2025-08-04 22:27:00,2025-08-04,Loss
0xae5eacaf9c6b9111fd53034a602c192a04e082ed,AIXBT,0.069305,9024.0,625.41,BUY,08-04-2025 22:27,18481.0,Open Long,0.0,0x7c52a54804544bc068620421281a9701f4004f4cdfbf3428013b9c4ac5c2a592,85021032792.0,True,0.210136,251000000000000.0,1740000000000.0,2025-08-04 22:27:00,2025-08-04,Loss
0xae5eacaf9c6b9111fd53034a602c192a04e082ed,AIXBT,0.069307,21641.0,1499.87,BUY,08-04-2025 22:27,27505.0,Open Long,0.0,0x7c52a54804544bc068620421281a9701f4004f4cdfbf3428013b9c4ac5c2a592,85021032792.0,True,0.503956,547000000000000.0,1740000000000.0,2025-08-04 22:27:00,2025-08-04,Loss
0xae5eacaf9c6b9111fd53034a602c192a04e082ed,AIXBT,0.069344,2480.0,171.97,BUY,08-04-2025 22:27,49146.0,Open Long,0.0,0x7c52a54804544bc068620421281a9701f4004f4cdfbf3428013b9c4ac5c2a592,85021032792.0,True,0.057782,1090000000000000.0,1740000000000.0,2025-08-04 22:27:00,2025-08-04,Loss
0xae5eacaf9c6b9111fd53034a602c192a04e082ed,AIXBT,0.069348,38657.0,2680.79,BUY,08-04-2025 22:27,51626.0,Open Long,0.0,0x7c52a54804544bc068620421281a9701f4004f4cdfbf3428013b9c4ac5c2a592,85021032792.0,True,0.900743,121000000000000.0,1740000000000.0,2025-08-04 22:27:00,2025-08-04,Loss
0xae5eacaf9c6b9111fd53034a602c192a04e082ed,AIXBT,0.069361,12195.0,845.86,BUY,08-04-2025 22:27,90283.0,Open Long,0.0,0x7c52a54804544bc068620421281a9701f4004f4cdfbf3428013b9c4ac5c2a592,85021032792.0,True,0.284208,379000000000000.0,1740000000000.0,2025-08-04 22:27:00,2025-08-04,Loss
0xae5eacaf9c6b9111fd53034a602c192a04e082ed,AIXBT,0.069371,59397.0,4120.43,BUY,08-04-2025 22:27,102478.0,Open Long,0.0,0x7c52a54804544bc068620421281a9701f4004f4cdfbf3428013b9c4ac5c2a592,85021032792.0,True,1.384464,866000000000000.0,1740000000000.0,2025-08-04 22:27:00,2025-08-04,Loss
0xae5eacaf9c6b9111fd53034a602c192a04e082ed,AIXBT,0.0694,221650.0,15382.51,BUY,08-04-2025 22:27,161875.0,Open Long,0.0,0x7c52a54804544bc068620421281a9701f4004f4cdfbf3428013b9c4ac5c2a592,85021032792.0,True,5.168522,326000000000000.0,1740000000000.0,2025-08-04 22:27:00,2025-08-04,Loss
0xae5eacaf9c6b9111fd53034a602c192a04e082ed,AIXBT,0.0694,7209.0,500.3,BUY,08-04-2025 22:27,383525.0,Open Long,0.0,0x7c52a54804544bc068620421281a9701f4004f4cdfbf3428013b9c4ac5c2a592,85021032792.0,True,0.168101,634000000000000.0,1740000000000.0,2025-08-04 22:27:00,2025-08-04,Loss
0xae5eacaf9c6b9111fd53034a602c192a04e082ed,AIXBT,0.069401,4244.0,294.54,BUY,08-04-2025 22:27,390734.0,Open Long,0.0,0x7c52a54804544bc068620421281a9701f4004f4cdfbf3428013b9c4ac5c2a592,85021032792.0,True,0.098964,652000000000000.0,1740000000000.0,2025-08-04 22:27:00,2025-08-04,Loss
0xae5eacaf9c6b9111fd53034a602c192a04e082ed,AIXBT,0.069409,15571.0,1080.77,BUY,08-04-2025 22:27,394978.0,Open Long,0.0,0x7c52a54804544bc068620421281a9701f4004f4cdfbf3428013b9c4ac5c2a592,85021032792.0,True,0.363137,1080000000000000.0,1740000000000.0,2025-08-04 22:27:00,2025-08-04,Loss
0xae5eacaf9c6b9111fd53034a602c192a04e082ed,AIXBT,0.069411,74866.0,5196.52,BUY,08-04-2025 22:27,410549.0,Open Long,0.0,0x7c52a54804544bc068620421281a9701f4004f4cdfbf3428013b9c4ac5c2a592,85021032792.0,True,1.746031,181000000000000.0,1740000000000.0,2025-08-04 22:27:00,2025-08-04,Loss
0xae5eacaf9c6b9111fd53034a602c192a04e082ed,AIXBT,0.069416,72214.0,5012.81,BUY,08-04-2025 22:27,485415.0,Open Long,0.0,0x7c52a54804544bc068620421281a9701f4004f4cdfbf3428013b9c4ac5c2a592,85021032792.0,True,1.684302,502000000000000.0,1740000000000.0,2025-08-04 22:27:00,2025-08-04,Loss
0xae5eacaf9c6b9111fd53034a602c192a04e082ed,AIXBT,0.06942,16286.0,1130.57,BUY,08-04-2025 22:27,557629.0,Open Long,0.0,0x7c52a54804544bc068620421281a9701f4004f4cdfbf3428013b9c4ac5c2a592,85021032792.0,True,0.379872,725000000000000.0,1740000000000.0,2025-08-04 22:27:00,2025-08-04,Loss
0xae5eacaf9c6b9111fd53034a602c192a04e082ed,AIXBT,0.069437,5935.0,412.11,BUY,08-04-2025 22:27,573915.0,Open Long,0.0,0x7c52a54804544bc068620421281a9701f4004f4cdfbf3428013b9c4ac5c2a592,85021032792.0,True,0.138468,132000000000000.0,1740000000000.0,2025-08-04 22:27:00,2025-08-04,Loss
0xae5eacaf9c6b9111fd53034a602c192a04e082ed,AIXBT,0.06944,14410.0,1000.63,BUY,08-04-2025 22:27,579850.0,Open Long,0.0,0x7c52a54804544bc068620421281a9701f4004f4cdfbf3428013b9c4ac5c2a592,85021032792.0,True,0.336211,132000000000000.0,1740000000000.0,2025-08-04 22:27:00,2025-08-04,Loss
0xae5eacaf9c6b9111fd53034a602c192a04e082ed,AIXBT,0.069443,5740.0,398.6,BUY,08-04-2025 22:27,594260.0,Open Long,0.0,0x7c52a54804544bc068620421281a9701f4004f4cdfbf3428013b9c4ac5c2a592,85021032792.0,True,0.133929,257000000000000.0,1740000000000.0,2025-08-04 22:27:00,2025-08-04,Loss
0xae5eacaf9c6b9111fd53034a602c192a04e082ed,GMX,12.092,37.49,453.33,BUY,09-04-2025 12:49,0.0,Open Long,0.0,0x655414a695c04e843b7c042131febf02015800e8341e484ec5a5df7a7c0d2ece,85225929291.0,True,0.152318,688000000000000.0,1740000000000.0,2025-09-04 12:49:00,2025-09-04,Loss
0xae5eacaf9c6b9111fd53034a602c192a04e082ed,GMX,12.093,9.87,119.36,BUY,09-04-2025 12:49,37.49,Open Long,0.0,0x655414a695c04e843b7c042131febf02015800e8341e484ec5a5df7a7c0d2ece,85225929291.0,True,0.040104,110000000000000.0,1740000000000.0,2025-09-04 12:49:00,2025-09-04,Loss
0xae5eacaf9c6b9111fd53034a602c192a04e082ed,GMX,12.094,36.51,441.55,BUY,09-04-2025 12:49,47.36,Open Long,0.0,0x655414a695c04e843b7c042131febf02015800e8341e484ec5a5df7a7c0d2ece,85225929291.0,True,0.148361,182000000000000.0,1740000000000.0,2025-09-04 12:49:00,2025-09-04,Loss
0xae5eacaf9c6b9111fd53034a602c192a04e082ed,GMX,12.094,41.21,498.39,BUY,09-04-2025 12:49,83.87,Open Long,0.0,0x655414a695c04e843b7c042131febf02015800e8341e484ec5a5df7a7c0d2ece,85225929291.0,True,0.167459,774000000000000.0,1740000000000.0,2025-09-04 12:49:00,2025-09-04,Loss
0xae5eacaf9c6b9111fd53034a602c192a04e082ed,GMX,12.095,87.78,1061.7,BUY,09-04-2025 12:49,125.08,Open Long,0.0,0x655414a695c04e843b7c042131febf02015800e8341e484ec5a5df7a7c0d2ece,85225929291.0,True,0.35673,149000000000000.0,1740000000000.0,2025-09-04 12:49:00,2025-09-04,Loss
0xae5eacaf9c6b9111fd53034a602c192a04e082ed,GMX,12.096,185.35,2241.99,BUY,09-04-2025 12:49,212.86,Open Long,0.0,0x655414a695c04e843b7c042131febf02015800e8341e484ec5a5df7a7c0d2ece,85225929291.0,True,0.753309,87700000000000.0,1740000000000.0,2025-09-04 12:49:00,2025-09-04,Loss
0xae5eacaf9c6b9111fd53034a602c192a04e082ed,GMX,12.099,1.79,21.66,BUY,09-04-2025 12:49,398.21,Open Long,0.0,0x655414a695c04e843b7c042131febf02015800e8341e484ec5a5df7a7c0d2ece,85225929291.0,True,0.007276,448000000000000.0,1740000000000.0,2025-09-04 12:49:00,2025-09-04,Loss
0xae5eacaf9c6b9111fd53034a602c192a04e082ed,GMX,13.655,1.58,21.57,SELL,09-04-2025 23:21,400.0,Close Long,2.464958,0xe9169b812ef266250dbf0421393ff402014200f0af3d8ea689f97ce1bd021733,85378937833.0,True,0.007248,1040000000000000.0,1740000000000.0,2025-09-04 23:21:00,2025-09-04,Profit
0xae5eacaf9c6b9111fd53034a602c192a04e082ed,GMX,13.655,30.64,418.39,SELL,09-04-2025 23:21,398.42,Close Long,47.801464,0xe9169b812ef266250dbf0421393ff402014200f0af3d8ea689f97ce1bd021733,85378937833.0,True,0.140578,77100000000000.0,1740000000000.0,2025-09-04 23:21:00,2025-09-04,Profit
0xae5eacaf9c6b9111fd53034a602c192a04e082ed,GMX,13.652,164.81,2249.99,SELL,09-04-2025 23:21,367.78,Close Long,256.625651,0xe9169b812ef266250dbf0421393ff402014200f0af3d8ea689f97ce1bd021733,85378937833.0,True,0.755995,418000000000000.0,1740000000000.0,2025-09-04 23:21:00,2025-09-04,Profit
0xae5eacaf9c6b9111fd53034a602c192a04e082ed,GMX,13.651,56.41,770.05,SELL,09-04-2025 23:21,202.97,Close Long,87.779601,0xe9169b812ef266250dbf0421393ff402014200f0af3d8ea689f97ce1bd021733,85378937833.0,True,0.258737,166000000000000.0,1740000000000.0,2025-09-04 23:21:00,2025-09-04,Profit
0xae5eacaf9c6b9111fd53034a602c192a04e082ed,GMX,13.65,87.78,1198.2,SELL,09-04-2025 23:21,146.56,Close Long,136.506678,0xe9169b812ef266250dbf0421393ff402014200f0af3d8ea689f97ce1bd021733,85378937833.0,True,0.402593,1000000000000000.0,1740000000000.0,2025-09-04 23:21:00,2025-09-04,Profit
0xae5eacaf9c6b9111fd53034a602c192a04e082ed,GMX,13.647,58.78,802.17,SELL,09-04-2025 23:21,58.78,Close Long,91.232438,0xe9169b812ef266250dbf0421393ff402014200f0af3d8ea689f97ce1bd021733,85378937833.0,True,0.269528,329000000000000.0,1740000000000.0,2025-09-04 23:21:00,2025-09-04,Profit
0xae5eacaf9c6b9111fd53034a602c192a04e082ed,AIXBT,0.078885,6365.0,502.1,SELL,10-04-2025 01:55,600000.0,Close Long,60.435675,0x08af2cb0618ada35724804213b09cd01fd0027e0a90f10934a798637de1e6bc9,85420942861.0,True,0.168706,689000000000000.0,1740000000000.0,2025-10-04 01:55:00,2025-10-04,Profit
0xae5eacaf9c6b9111fd53034a602c192a04e082ed,AIXBT,0.078885,6868.0,541.78,SELL,10-04-2025 01:55,593635.0,Close Long,65.21166,0x08af2cb0618ada35724804213b09cd01fd0027e0a90f10934a798637de1e6bc9,85420942861.0,True,0.182038,1130000000000000.0,1740000000000.0,2025-10-04 01:55:00,2025-10-04,Profit
0xae5eacaf9c6b9111fd53034a602c192a04e082ed,AIXBT,0.078846,11678.0,920.76,SELL,10-04-2025 01:55,586767.0,Close Long,110.427168,0x08af2cb0618ada35724804213b09cd01fd0027e0a90f10934a798637de1e6bc9,85420942861.0,True,0.309376,1020000000000000.0,1740000000000.0,2025-10-04 01:55:00,2025-10-04,Profit
0xae5eacaf9c6b9111fd53034a602c192a04e082ed,AIXBT,0.078846,12195.0,961.53,SELL,10-04-2025 01:55,575089.0,Close Long,115.31592,0x08af2cb0618ada35724804213b09cd01fd0027e0a90f10934a798637de1e6bc9,85420942861.0,True,0.323072,1070000000000000.0,1740000000000.0,2025-10-04 01:55:00,2025-10-04,Profit
0xae5eacaf9c6b9111fd53034a602c192a04e082ed,AIXBT,0.07881,28583.0,2252.63,SELL,10-04-2025 01:55,562894.0,Close Long,269.25186,0x08af2cb0618ada35724804213b09cd01fd0027e0a90f10934a798637de1e6bc9,85420942861.0,True,0.756882,458000000000000.0,1740000000000.0,2025-10-04 01:55:00,2025-10-04,Profit
0xae5eacaf9c6b9111fd53034a602c192a04e082ed,AIXBT,0.078806,12195.0,961.04,SELL,10-04-2025 01:55,534311.0,Close Long,114.82812,0x08af2cb0618ada35724804213b09cd01fd0027e0a90f10934a798637de1e6bc9,85420942861.0,True,0.322908,725000000000000.0,1740000000000.0,2025-10-04 01:55:00,2025-10-04,Profit
0xae5eacaf9c6b9111fd53034a602c192a04e082ed,AIXBT,0.07879,6348.0,500.16,SELL,10-04-2025 01:55,522116.0,Close Long,59.6712,0x08af2cb0618ada35724804213b09cd01fd0027e0a90f10934a798637de1e6bc9,85420942861.0,True,0.168052,484000000000000.0,1740000000000.0,2025-10-04 01:55:00,2025-10-04,Profit
0xae5eacaf9c6b9111fd53034a602c192a04e082ed,AIXBT,0.078783,3858.0,303.94,SELL,10-04-2025 01:55,515768.0,Close Long,36.238194,0x08af2cb0618ada35724804213b09cd01fd0027e0a90f10934a798637de1e6bc9,85420942861.0,True,0.102124,62600000000000.0,1740000000000.0,2025-10-04 01:55:00,2025-10-04,Profit
0xae5eacaf9c6b9111fd53034a602c192a04e082ed,AIXBT,0.078782,3420.0,269.43,SELL,10-04-2025 01:55,511910.0,Close Long,32.12064,0x08af2cb0618ada35724804213b09cd01fd0027e0a90f10934a798637de1e6bc9,85420942861.0,True,0.090529,569000000000000.0,1740000000000.0,2025-10-04 01:55:00,2025-10-04,Profit
0xae5eacaf9c6b9111fd53034a602c192a04e082ed,AIXBT,0.078779,12835.0,1011.13,SELL,10-04-2025 01:55,508490.0,Close Long,120.507815,0x08af2cb0618ada35724804213b09cd01fd0027e0a90f10934a798637de1e6bc9,85420942861.0,True,0.339738,855000000000000.0,1740000000000.0,2025-10-04 01:55:00,2025-10-04,Profit
0xae5eacaf9c6b9111fd53034a602c192a04e082ed,AIXBT,0.07876,124356.0,9794.28,SELL,10-04-2025 01:55,495655.0,Close Long,1165.21572,0x08af2cb0618ada35724804213b09cd01fd0027e0a90f10934a798637de1e6bc9,85420942861.0,True,3.290877,129000000000000.0,1740000000000.0,2025-10-04 01:55:00,2025-10-04,Profit
0xae5eacaf9c6b9111fd53034a602c192a04e082ed,AIXBT,0.078759,12529.0,986.77,SELL,10-04-2025 01:55,371299.0,Close Long,117.384201,0x08af2cb0618ada35724804213b09cd01fd0027e0a90f10934a798637de1e6bc9,85420942861.0,True,0.331555,249000000000000.0,1740000000000.0,2025-10-04 01:55:00,2025-10-04,Profit
0xae5eacaf9c6b9111fd53034a602c192a04e082ed,AIXBT,0.07874,6351.0,500.08,SELL,10-04-2025 01:55,358770.0,Close Long,59.38185,0x08af2cb0618ada35724804213b09cd01fd0027e0a90f10934a798637de1e6bc9,85420942861.0,True,0.168025,893000000000000.0,1740000000000.0,2025-10-04 01:55:00,2025-10-04,Profit
0xae5eacaf9c6b9111fd53034a602c192a04e082ed,AIXBT,0.078734,6234.0,490.83,SELL,10-04-2025 01:55,352419.0,Close Long,58.250496,0x08af2cb0618ada35724804213b09cd01fd0027e0a90f10934a798637de1e6bc9,85420942861.0,True,0.164917,171000000000000.0,1740000000000.0,2025-10-04 01:55:00,2025-10-04,Profit
0xae5eacaf9c6b9111fd53034a602c192a04e082ed,AIXBT,0.078734,253691.0,19974.11,SELL,10-04-2025 01:55,346185.0,Close Long,2370.488704,0x08af2cb0618ada35724804213b09cd01fd0027e0a90f10934a798637de1e6bc9,85420942861.0,True,6.711299,217000000000000.0,1740000000000.0,2025-10-04 01:55:00,2025-10-04,Profit
0xae5eacaf9c6b9111fd53034a602c192a04e082ed,AIXBT,0.07873,12893.0,1015.07,SELL,10-04-2025 01:55,92494.0,Close Long,120.42062,0x08af2cb0618ada35724804213b09cd01fd0027e0a90f10934a798637de1e6bc9,85420942861.0,True,0.341062,890000000000000.0,1740000000000.0,2025-10-04 01:55:00,2025-10-04,Profit
0xae5eacaf9c6b9111fd53034a602c192a04e082ed,AIXBT,0.078711,3858.0,303.67,SELL,10-04-2025 01:55,79601.0,Close Long,35.960418,0x08af2cb0618ada35724804213b09cd01fd0027e0a90f10934a798637de1e6bc9,85420942861.0,True,0.102031,186000000000000.0,1740000000000.0,2025-10-04 01:55:00,2025-10-04,Profit
0xae5eacaf9c6b9111fd53034a602c192a04e082ed,AIXBT,0.078696,43281.0,3406.04,SELL,10-04-2025 01:55,75743.0,Close Long,402.772986,0x08af2cb0618ada35724804213b09cd01fd0027e0a90f10934a798637de1e6bc9,85420942861.0,True,1.144429,836000000000000.0,1740000000000.0,2025-10-04 01:55:00,2025-10-04,Profit
0xae5eacaf9c6b9111fd53034a602c192a04e082ed,AIXBT,0.078694,32462.0,2554.56,SELL,10-04-2025 01:55,32462.0,Close Long,302.026448,0x08af2cb0618ada35724804213b09cd01fd0027e0a90f10934a798637de1e6bc9,85420942861.0,True,0.858333,513000000000000.0,1740000000000.0,2025-10-04 01:55:00,2025-10-04,Profit
0xae5eacaf9c6b9111fd53034a602c192a04e082ed,AIXBT,0.082647,300.0,24.79,BUY,12-04-2025 15:51,0.0,Open Long,0.0,0xb1294e924280e1830b50042165333f014a0013b273ab5c897ac3ccdc6de8afc3,85999083534.0,True,0.008329,1040000000000000.0,1740000000000.0,2025-12-04 15:51:00,2025-12-04,Loss
0xae5eacaf9c6b9111fd53034a602c192a04e082ed,AIXBT,0.082648,18149.0,1499.98,BUY,12-04-2025 15:51,300.0,Open Long,0.0,0xb1294e924280e1830b50042165333f014a0013b273ab5c897ac3ccdc6de8afc3,85999083534.0,True,0.503992,302000000000000.0,1740000000000.0,2025-12-04 15:51:00,2025-12-04,Loss
0xae5eacaf9c6b9111fd53034a602c192a04e082ed,AIXBT,0.082656,5180.0,428.16,BUY,12-04-2025 15:51,18449.0,Open Long,0.0,0xb1294e924280e1830b50042165333f014a0013b273ab5c897ac3ccdc6de8afc3,85999083534.0,True,0.14386,625000000000000.0,1740000000000.0,2025-12-04 15:51:00,2025-12-04,Loss
0xae5eacaf9c6b9111fd53034a602c192a04e082ed,AIXBT,0.082656,4857.0,401.46,BUY,12-04-2025 15:51,23629.0,Open Long,0.0,0xb1294e924280e1830b50042165333f014a0013b273ab5c897ac3ccdc6de8afc3,85999083534.0,True,0.13489,738000000000000.0,1740000000000.0,2025-12-04 15:51:00,2025-12-04,Loss
0xae5eacaf9c6b9111fd53034a602c192a04e082ed,AIXBT,0.082689,13548.0,1120.27,BUY,12-04-2025 15:51,28486.0,Open Long,0.0,0xb1294e924280e1830b50042165333f014a0013b273ab5c897ac3ccdc6de8afc3,85999083534.0,True,0.37641,742000000000000.0,1740000000000.0,2025-12-04 15:51:00,2025-12-04,Loss
0xae5eacaf9c6b9111fd53034a602c192a04e082ed,AIXBT,0.082698,20173.0,1668.27,BUY,12-04-2025 15:51,42034.0,Open Long,0.0,0xb1294e924280e1830b50042165333f014a0013b273ab5c897ac3ccdc6de8afc3,85999083534.0,True,0.560537,790000000000000.0,1740000000000.0,2025-12-04 15:51:00,2025-12-04,Loss
0xae5eacaf9c6b9111fd53034a602c192a04e082ed,AIXBT,0.082712,9523.0,787.67,BUY,12-04-2025 15:51,62207.0,Open Long,0.0,0xb1294e924280e1830b50042165333f014a0013b273ab5c897ac3ccdc6de8afc3,85999083534.0,True,0.264655,536000000000000.0,1740000000000.0,2025-12-04 15:51:00,2025-12-04,Loss
0xae5eacaf9c6b9111fd53034a602c192a04e082ed,AIXBT,0.082712,11191.0,925.63,BUY,12-04-2025 15:51,71730.0,Open Long,0.0,0xb1294e924280e1830b50042165333f014a0013b273ab5c897ac3ccdc6de8afc3,85999083534.0,True,0.311011,490000000000000.0,1740000000000.0,2025-12-04 15:51:00,2025-12-04,Loss
0xae5eacaf9c6b9111fd53034a602c192a04e082ed,AIXBT,0.082718,12195.0,1008.75,BUY,12-04-2025 15:51,82921.0,Open Long,0.0,0xb1294e924280e1830b50042165333f014a0013b273ab5c897ac3ccdc6de8afc3,85999083534.0,True,0.338938,538000000000000.0,1740000000000.0,2025-12-04 15:51:00,2025-12-04,Loss
0xae5eacaf9c6b9111fd53034a602c192a04e082ed,AIXBT,0.08272,6047.0,500.21,BUY,12-04-2025 15:51,95116.0,Open Long,0.0,0xb1294e924280e1830b50042165333f014a0013b273ab5c897ac3ccdc6de8afc3,85999083534.0,True,0.168069,230000000000000.0,1740000000000.0,2025-12-04 15:51:00,2025-12-04,Loss
0xae5eacaf9c6b9111fd53034a602c192a04e082ed,AIXBT,0.082724,3513.0,290.61,BUY,12-04-2025 15:51,101163.0,Open Long,0.0,0xb1294e924280e1830b50042165333f014a0013b273ab5c897ac3ccdc6de8afc3,85999083534.0,True,0.097644,784000000000000.0,1740000000000.0,2025-12-04 15:51:00,2025-12-04,Loss
0xae5eacaf9c6b9111fd53034a602c192a04e082ed,AIXBT,0.08274,15808.0,1307.95,BUY,12-04-2025 15:51,104676.0,Open Long,0.0,0xb1294e924280e1830b50042165333f014a0013b273ab5c897ac3ccdc6de8afc3,85999083534.0,True,0.439471,882000000000000.0,1740000000000.0,2025-12-04 15:51:00,2025-12-04,Loss
0xae5eacaf9c6b9111fd53034a602c192a04e082ed,AIXBT,0.082749,13601.0,1125.47,BUY,12-04-2025 15:51,120484.0,Open Long,0.0,0xb1294e924280e1830b50042165333f014a0013b273ab5c897ac3ccdc6de8afc3,85999083534.0,True,0.378157,926000000000000.0,1740000000000.0,2025-12-04 15:51:00,2025-12-04,Loss
0xae5eacaf9c6b9111fd53034a602c192a04e082ed,AIXBT,0.08275,113029.0,9353.15,BUY,12-04-2025 15:51,134085.0,Open Long,0.0,0xb1294e924280e1830b50042165333f014a0013b273ab5c897ac3ccdc6de8afc3,85999083534.0,True,3.142657,1000000000000000.0,1740000000000.0,2025-12-04 15:51:00,2025-12-04,Loss
0xae5eacaf9c6b9111fd53034a602c192a04e082ed,AIXBT,0.08277,12086.0,1000.36,BUY,12-04-2025 15:51,247114.0,Open Long,0.0,0xb1294e924280e1830b50042165333f014a0013b273ab5c897ac3ccdc6de8afc3,85999083534.0,True,0.33612,621000000000000.0,1740000000000.0,2025-12-04 15:51:00,2025-12-04,Loss
0xae5eacaf9c6b9111fd53034a602c192a04e082ed,AIXBT,0.082771,116659.0,9655.98,BUY,12-04-2025 15:51,259200.0,Open Long,0.0,0xb1294e924280e1830b50042165333f014a0013b273ab5c897ac3ccdc6de8afc3,85999083534.0,True,3.244409,163000000000000.0,1740000000000.0,2025-12-04 15:51:00,2025-12-04,Loss
0xae5eacaf9c6b9111fd53034a602c192a04e082ed,AIXBT,0.082793,5667.0,469.19,BUY,12-04-2025 15:51,375859.0,Open Long,0.0,0xb1294e924280e1830b50042165333f014a0013b273ab5c897ac3ccdc6de8afc3,85999083534.0,True,0.157646,910000000000000.0,1740000000000.0,2025-12-04 15:51:00,2025-12-04,Loss
0xae5eacaf9c6b9111fd53034a602c192a04e082ed,AIXBT,0.082793,10999.0,910.64,BUY,12-04-2025 15:51,381526.0,Open Long,0.0,0xb1294e924280e1830b50042165333f014a0013b273ab5c897ac3ccdc6de8afc3,85999083534.0,True,0.305975,132000000000000.0,1740000000000.0,2025-12-04 15:51:00,2025-12-04,Loss
0xae5eacaf9c6b9111fd53034a602c192a04e082ed,AIXBT,0.082793,9589.0,793.9,BUY,12-04-2025 15:51,392525.0,Open Long,0.0,0xb1294e924280e1830b50042165333f014a0013b273ab5c897ac3ccdc6de8afc3,85999083534.0,True,0.26675,972000000000000.0,1740000000000.0,2025-12-04 15:51:00,2025-12-04,Loss
0xae5eacaf9c6b9111fd53034a602c192a04e082ed,AIXBT,0.082796,30738.0,2544.98,BUY,12-04-2025 15:51,402114.0,Open Long,0.0,0xb1294e924280e1830b50042165333f014a0013b273ab5c897ac3ccdc6de8afc3,85999083534.0,True,0.855114,83300000000000.0,1740000000000.0,2025-12-04 15:51:00,2025-12-04,Loss
0xae5eacaf9c6b9111fd53034a602c192a04e082ed,AIXBT,0.0828,167148.0,13839.85,BUY,12-04-2025 15:51,432852.0,Open Long,0.0,0xb1294e924280e1830b50042165333f014a0013b273ab5c897ac3ccdc6de8afc3,85999083534.0,True,4.650191,1040000000000000.0,1740000000000.0,2025-12-04 15:51:00,2025-12-04,Loss
0xae5eacaf9c6b9111fd53034a602c192a04e082ed,AIXBT,0.087106,5825.0,507.39,SELL,12-04-2025 20:07,600000.0,Close Long,25.3038,0xdccb756e0d44199b1eae0421681a120205870049e634ccabfcc25703a483f421,86040314167.0,True,0.170483,2440000000000.0,1740000000000.0,2025-12-04 20:07:00,2025-12-04,Profit
0xae5eacaf9c6b9111fd53034a602c192a04e082ed,AIXBT,0.087106,6277.0,546.76,SELL,12-04-2025 20:07,594175.0,Close Long,27.267288,0xdccb756e0d44199b1eae0421681a120205870049e634ccabfcc25703a483f421,86040314167.0,True,0.183712,18100000000000.0,1740000000000.0,2025-12-04 20:07:00,2025-12-04,Profit
0xae5eacaf9c6b9111fd53034a602c192a04e082ed,AIXBT,0.087097,6931.0,603.67,SELL,12-04-2025 20:07,587898.0,Close Long,30.045885,0xdccb756e0d44199b1eae0421681a120205870049e634ccabfcc25703a483f421,86040314167.0,True,0.202832,273000000000000.0,1740000000000.0,2025-12-04 20:07:00,2025-12-04,Profit
0xae5eacaf9c6b9111fd53034a602c192a04e082ed,AIXBT,0.087083,10170.0,885.63,SELL,12-04-2025 20:07,580967.0,Close Long,43.94457,0xdccb756e0d44199b1eae0421681a120205870049e634ccabfcc25703a483f421,86040314167.0,True,0.297572,202000000000000.0,1740000000000.0,2025-12-04 20:07:00,2025-12-04,Profit
0xae5eacaf9c6b9111fd53034a602c192a04e082ed,AIXBT,0.087081,13548.0,1179.77,SELL,12-04-2025 20:07,570797.0,Close Long,58.513812,0xdccb756e0d44199b1eae0421681a120205870049e634ccabfcc25703a483f421,86040314167.0,True,0.396403,1070000000000000.0,1740000000000.0,2025-12-04 20:07:00,2025-12-04,Profit
0xae5eacaf9c6b9111fd53034a602c192a04e082ed,AIXBT,0.087068,11911.0,1037.07,SELL,12-04-2025 20:07,557249.0,Close Long,51.288766,0xdccb756e0d44199b1eae0421681a120205870049e634ccabfcc25703a483f421,86040314167.0,True,0.348454,84400000000000.0,1740000000000.0,2025-12-04 20:07:00,2025-12-04,Profit
0xae5eacaf9c6b9111fd53034a602c192a04e082ed,AIXBT,0.08705,13149.0,1144.62,SELL,12-04-2025 20:07,545338.0,Close Long,56.382912,0xdccb756e0d44199b1eae0421681a120205870049e634ccabfcc25703a483f421,86040314167.0,True,0.384592,321000000000000.0,1740000000000.0,2025-12-04 20:07:00,2025-12-04,Profit
0xae5eacaf9c6b9111fd53034a602c192a04e082ed,AIXBT,0.087032,12070.0,1050.48,SELL,12-04-2025 20:07,532189.0,Close Long,51.5389,0xdccb756e0d44199b1eae0421681a120205870049e634ccabfcc25703a483f421,86040314167.0,True,0.352959,690000000000000.0,1740000000000.0,2025-12-04 20:07:00,2025-12-04,Profit
0xae5eacaf9c6b9111fd53034a602c192a04e082ed,AIXBT,0.087032,14025.0,1220.62,SELL,12-04-2025 20:07,520119.0,Close Long,59.88675,0xdccb756e0d44199b1eae0421681a120205870049e634ccabfcc25703a483f421,86040314167.0,True,0.410129,696000000000000.0,1740000000000.0,2025-12-04 20:07:00,2025-12-04,Profit
0xae5eacaf9c6b9111fd53034a602c192a04e082ed,AIXBT,0.08703,16746.0,1457.4,SELL,12-04-2025 20:07,506094.0,Close Long,71.471928,0xdccb756e0d44199b1eae0421681a120205870049e634ccabfcc25703a483f421,86040314167.0,True,0.489687,415000000000000.0,1740000000000.0,2025-12-04 20:07:00,2025-12-04,Profit
0xae5eacaf9c6b9111fd53034a602c192a04e082ed,AIXBT,0.087025,3513.0,305.72,SELL,12-04-2025 20:07,489348.0,Close Long,14.975919,0xdccb756e0d44199b1eae0421681a120205870049e634ccabfcc25703a483f421,86040314167.0,True,0.10272,697000000000000.0,1740000000000.0,2025-12-04 20:07:00,2025-12-04,Profit
0xae5eacaf9c6b9111fd53034a602c192a04e082ed,AIXBT,0.087,16018.0,1393.57,SELL,12-04-2025 20:07,485835.0,Close Long,67.884284,0xdccb756e0d44199b1eae0421681a120205870049e634ccabfcc25703a483f421,86040314167.0,True,0.468238,665000000000000.0,1740000000000.0,2025-12-04 20:07:00,2025-12-04,Profit
0xae5eacaf9c6b9111fd53034a602c192a04e082ed,AIXBT,0.086981,5568.0,484.31,SELL,12-04-2025 20:07,469817.0,Close Long,23.491392,0xdccb756e0d44199b1eae0421681a120205870049e634ccabfcc25703a483f421,86040314167.0,True,0.162727,67100000000000.0,1740000000000.0,2025-12-04 20:07:00,2025-12-04,Profit
0xae5eacaf9c6b9111fd53034a602c192a04e082ed,AIXBT,0.086978,14139.0,1229.78,SELL,12-04-2025 20:07,464249.0,Close Long,59.610024,0xdccb756e0d44199b1eae0421681a120205870049e634ccabfcc25703a483f421,86040314167.0,True,0.413206,863000000000000.0,1740000000000.0,2025-12-04 20:07:00,2025-12-04,Profit
0xae5eacaf9c6b9111fd53034a602c192a04e082ed,AIXBT,0.086961,3513.0,305.49,SELL,12-04-2025 20:07,450110.0,Close Long,14.751087,0xdccb756e0d44199b1eae0421681a120205870049e634ccabfcc25703a483f421,86040314167.0,True,0.102645,690000000000000.0,1740000000000.0,2025-12-04 20:07:00,2025-12-04,Profit
0xae5eacaf9c6b9111fd53034a602c192a04e082ed,AIXBT,0.086957,69740.0,6064.38,SELL,12-04-2025 20:07,446597.0,Close Long,292.5593,0xdccb756e0d44199b1eae0421681a120205870049e634ccabfcc25703a483f421,86040314167.0,True,2.037631,340000000000000.0,1740000000000.0,2025-12-04 20:07:00,2025-12-04,Profit
0xae5eacaf9c6b9111fd53034a602c192a04e082ed,AIXBT,0.086955,11705.0,1017.81,SELL,12-04-2025 20:07,376857.0,Close Long,49.079065,0xdccb756e0d44199b1eae0421681a120205870049e634ccabfcc25703a483f421,86040314167.0,True,0.341982,132000000000000.0,1740000000000.0,2025-12-04 20:07:00,2025-12-04,Profit
0xae5eacaf9c6b9111fd53034a602c192a04e082ed,AIXBT,0.086949,106176.0,9231.9,SELL,12-04-2025 20:07,365152.0,Close Long,444.558912,0xdccb756e0d44199b1eae0421681a120205870049e634ccabfcc25703a483f421,86040314167.0,True,3.101916,793000000000000.0,1740000000000.0,2025-12-04 20:07:00,2025-12-04,Profit
0xae5eacaf9c6b9111fd53034a602c192a04e082ed,AIXBT,0.086932,22525.0,1958.14,SELL,12-04-2025 20:07,258976.0,Close Long,93.92925,0xdccb756e0d44199b1eae0421681a120205870049e634ccabfcc25703a483f421,86040314167.0,True,0.657936,583000000000000.0,1740000000000.0,2025-12-04 20:07:00,2025-12-04,Profit
0xae5eacaf9c6b9111fd53034a602c192a04e082ed,AIXBT,0.086913,107628.0,9354.27,SELL,12-04-2025 20:07,236451.0,Close Long,446.763828,0xdccb756e0d44199b1eae0421681a120205870049e634ccabfcc25703a483f421,86040314167.0,True,3.143035,788000000000000.0,1740000000000.0,2025-12-04 20:07:00,2025-12-04,Profit
0xae5eacaf9c6b9111fd53034a602c192a04e082ed,AIXBT,0.08691,5754.0,500.08,SELL,12-04-2025 20:07,128823.0,Close Long,23.867592,0xdccb756e0d44199b1eae0421681a120205870049e634ccabfcc25703a483f421,86040314167.0,True,0.168026,607000000000000.0,1740000000000.0,2025-12-04 20:07:00,2025-12-04,Profit
0xae5eacaf9c6b9111fd53034a602c192a04e082ed,AIXBT,0.086896,25536.0,2218.98,SELL,12-04-2025 20:07,123069.0,Close Long,105.565824,0xdccb756e0d44199b1eae0421681a120205870049e634ccabfcc25703a483f421,86040314167.0,True,0.745575,418000000000000.0,1740000000000.0,2025-12-04 20:07:00,2025-12-04,Profit
0xae5eacaf9c6b9111fd53034a602c192a04e082ed,AIXBT,0.086894,3513.0,305.26,SELL,12-04-2025 20:07,97533.0,Close Long,14.515716,0xdccb756e0d44199b1eae0421681a120205870049e634ccabfcc25703a483f421,86040314167.0,True,0.102566,139000000000000.0,1740000000000.0,2025-12-04 20:07:00,2025-12-04,Profit
0xae5eacaf9c6b9111fd53034a602c192a04e082ed,AIXBT,0.08687,94020.0,8167.52,SELL,12-04-2025 20:07,94020.0,Close Long,386.23416,0xdccb756e0d44199b1eae0421681a120205870049e634ccabfcc25703a483f421,86040314167.0,True,2.744285,870000000000000.0,1740000000000.0,2025-12-04 20:07:00,2025-12-04,Profit
0x72c6a4624e1dffa724e6d00d64ceae698af892a0,HYPE,17.92,173.92,3116.65,SELL,12-12-2024 15:53,0.0,Open Short,0.0,0xd7ba3d9b5a6804bfb49f04190ad1ba0204bb0021c03f4440c658262b30acb1cb,54878225438.0,False,0.299197,965000000000000.0,1730000000000.0,2024-12-12 15:53:00,2024-12-12,Loss
0x72c6a4624e1dffa724e6d00d64ceae698af892a0,HYPE,17.92,9.55,171.14,SELL,12-12-2024 15:53,-173.92,Open Short,0.0,0x7ea46d82f8f3a1379c8004190ad4950201990073e0fcad9f08e98a5aef2ab5d9,54878225438.0,False,0.016428,434000000000000.0,1730000000000.0,2024-12-12 15:53:00,2024-12-12,Loss
0x72c6a4624e1dffa724e6d00d64ceae698af892a0,HYPE,17.92,28.33,507.67,SELL,12-12-2024 15:53,-183.47,Open Short,0.0,0x71c478b66f1b21da07b504190ad49502019a00f9b7dc94258e00cb670c8459bb,54878225438.0,False,0.048736,655000000000000.0,1730000000000.0,2024-12-12 15:53:00,2024-12-12,Loss
0x72c6a4624e1dffa724e6d00d64ceae698af892a0,HYPE,17.92,14.0,250.88,SELL,12-12-2024 15:53,-211.8,Open Short,0.0,0x7c9e4f1fedf91978903004190ad4b30136000eb04153c3507bb2e408e8e7f727,54878225438.0,False,0.024084,989000000000000.0,1730000000000.0,2024-12-12 15:53:00,2024-12-12,Loss
0x72c6a4624e1dffa724e6d00d64ceae698af892a0,HYPE,17.92,1.5,26.88,SELL,12-12-2024 15:53,-225.8,Open Short,0.0,0x93f772db233a6c6a62bf04190ad4b3013e0023e20ec3da75e905e2c521230325,54878225438.0,False,0.00258,587000000000000.0,1730000000000.0,2024-12-12 15:53:00,2024-12-12,Loss
0x72c6a4624e1dffa724e6d00d64ceae698af892a0,HYPE,17.92,11.0,197.12,SELL,12-12-2024 15:53,-227.3,Open Short,0.0,0xc3b0d675b338d4acb50304190ad4d001d000dabf2023928295aeee1dd9aca52a,54878225438.0,False,0.018923,200000000000000.0,1730000000000.0,2024-12-12 15:53:00,2024-12-12,Loss
0x72c6a4624e1dffa724e6d00d64ceae698af892a0,HYPE,17.92,2.08,37.27,SELL,12-12-2024 15:54,-238.3,Open Short,0.0,0x0000000000000000000000000000000000000000000000000000000000000000,54878225438.0,False,0.003577,597000000000000.0,1730000000000.0,2024-12-12 15:54:00,2024-12-12,Loss
0x72c6a4624e1dffa724e6d00d64ceae698af892a0,HYPE,17.92,0.65,11.65,SELL,12-12-2024 15:54,-240.38,Open Short,0.0,0x0000000000000000000000000000000000000000000000000000000000000000,54878225438.0,False,0.001117,903000000000000.0,1730000000000.0,2024-12-12 15:54:00,2024-12-12,Loss
0x72c6a4624e1dffa724e6d00d64ceae698af892a0,HYPE,17.92,2.28,40.86,SELL,12-12-2024 15:54,-241.03,Open Short,0.0,0xdfdd4a4de5f71c5f29b304190ad52f01f00040028d12b8337c728c0d70a67616,54878225438.0,False,0.003921,301000000000000.0,1730000000000.0,2024-12-12 15:54:00,2024-12-12,Loss
0x72c6a4624e1dffa724e6d00d64ceae698af892a0,HYPE,17.92,3.8,68.1,SELL,12-12-2024 15:54,-243.31,Open Short,0.0,0x5885ec1fd46ce596967404190ad5400201ed009ca1770b47bd7b3dbbb46c5416,54878225438.0,False,0.006536,856000000000000.0,1730000000000.0,2024-12-12 15:54:00,2024-12-12,Loss
0x72c6a4624e1dffa724e6d00d64ceae698af892a0,HYPE,17.92,100.0,1792.0,SELL,12-12-2024 15:54,-247.11,Open Short,0.0,0x131224a6452757cbf44c04190ad56a01e5007c7da0595f83146f62c99ec8de67,54878225438.0,False,0.172032,612000000000000.0,1730000000000.0,2024-12-12 15:54:00,2024-12-12,Loss
0x72c6a4624e1dffa724e6d00d64ceae698af892a0,HYPE,17.92,28.79,515.92,SELL,12-12-2024 15:54,-347.11,Open Short,0.0,0x5b0f8857015198b4656204190ad60501bb00a0d5bff3628c787999333f27e5d8,54878225438.0,False,0.049527,910000000000000.0,1730000000000.0,2024-12-12 15:54:00,2024-12-12,Loss
0x72c6a4624e1dffa724e6d00d64ceae698af892a0,HYPE,17.92,129.5,2320.64,SELL,12-12-2024 15:54,-375.9,Open Short,0.0,0x3f0d651e6a73c57f11f804190ad68b01a800ab4d9637cb1ebff5eec9f7c06e41,54878225438.0,False,0.222781,326000000000000.0,1730000000000.0,2024-12-12 15:54:00,2024-12-12,Loss
0x72c6a4624e1dffa724e6d00d64ceae698af892a0,HYPE,17.92,11.6,207.87,SELL,12-12-2024 15:54,-505.4,Open Short,0.0,0x0000000000000000000000000000000000000000000000000000000000000000,54878225438.0,False,0.019955,179000000000000.0,1730000000000.0,2024-12-12 15:54:00,2024-12-12,Loss
0x72c6a4624e1dffa724e6d00d64ceae698af892a0,HYPE,17.89,96.21,1721.2,SELL,12-12-2024 16:07,-517.0,Open Short,0.0,0x0e67a96b8f72da845d4304190b0529019c00b57fb63d77fa658a46e78633c6a9,54885037020.0,False,0.165234,23000000000000.0,1730000000000.0,2024-12-12 16:07:00,2024-12-12,Loss
0x72c6a4624e1dffa724e6d00d64ceae698af892a0,HYPE,17.89,400.0,7156.0,SELL,12-12-2024 16:07,-613.21,Open Short,0.0,0x96bf3990adcf78d78cfa04190b0529019d005ca7a9482dde31da06b97cc9b5da,54885037020.0,False,0.686976,838000000000000.0,1730000000000.0,2024-12-12 16:07:00,2024-12-12,Loss
0x72c6a4624e1dffa724e6d00d64ceae698af892a0,HYPE,17.89,313.79,5613.7,SELL,12-12-2024 16:07,-1013.21,Open Short,0.0,0x78a4973824bb7612f89104190b052a0184004dd9aa49f13b8c46323435cfb56b,54885037020.0,False,0.538915,204000000000000.0,1730000000000.0,2024-12-12 16:07:00,2024-12-12,Loss
0x72c6a4624e1dffa724e6d00d64ceae698af892a0,HYPE,25.977,265.81,6904.95,SELL,02-01-2025 15:58,-39711.8,Open Short,0.0,0xa22d8c85ff46d8d61583041a774b01020159007420f68a96338f43e2abbd048c,60191905189.0,False,0.662874,991000000000000.0,1740000000000.0,2025-02-01 15:58:00,2025-02-01,Loss
0x72c6a4624e1dffa724e6d00d64ceae698af892a0,HYPE,25.977,274.19,7122.63,SELL,02-01-2025 15:58,-39977.61,Open Short,0.0,0xa33357cd4f31e6843c8a041a774b0c0101000066cdecacb3e68a46e2f8f3ead3,60191905189.0,False,0.683772,949000000000000.0,1740000000000.0,2025-02-01 15:58:00,2025-02-01,Loss
0x72c6a4624e1dffa724e6d00d64ceae698af892a0,HYPE,25.31,500.0,12655.0,SELL,02-01-2025 19:15,-40251.8,Open Short,0.0,0xf46847f243d1afa575cd041a7a224601cc00f3eec026f9f6168ff8d9e899a788,60213038721.0,False,1.21488,934000000000000.0,1740000000000.0,2025-02-01 19:15:00,2025-02-01,Loss
